5044, Green, Guardian, Purple, Small, Gray, , , 3D Glasses, Crescent Talisman, 
5045, Green, Tabby, Blue, Short, Gray, Side-eye, White, , Fire, 
5046, Purple, Crescent, Red, Short, Orange, Relaxed, Yellow, , , Hoodie Down
5047, Blue, Crescent, Black, Short, Gray, Discerning, Red, , , 
5048, Yellow, Crescent, Blue, Small, Orange, Discerning, Blue, Monocle, Backwards Hat, 
5049, Pink, Skeleton, Bone, Small, Skeleton, Relaxed, Skeleton, Eyepatch, Diamond, 
5050, Gray, Tabby, Black, Small, Orange, Open, Red, , Halo, Gold Chain
5051, Yellow, Stark, Purple, Small, Gray, Open, White, , Forest Ranger, 
5052, Blue, Guardian, Red, Short, Orange, Angry, Yellow, Eyepatch, Karate Band, 
5053, Yellow, Crescent, Purple, Small, Gray, Angry, Yellow, , Bucket Hat, 
5054, Blue, Professor, Gray, Small, Orange, Side-eye, Green, , Rubber Duck, 
5055, Yellow, Crescent, White, Small, Orange, Diamond, Epic, , Raincloud, 
5056, Blue, Tabby, Gray, Short, Orange, Open, Blue, , Raincloud, 
5057, Purple, Tabby, Pink, Small, Gray, Open, Yellow, , Fire, 
5058, Pink, Emperor, Blue, Small, Orange, , , Rose-Colored Glasses, Bandana, 
5059, Gray, Sage, Blue, Small, Orange, Heart, Epic, , Skully, 
5060, Green, Crescent, Red, Small, Gray, Angry, Purple, , Pirate's Hat, 
5061, Pink, Tranquil, Gray, Short, Gray, Open, Blue, , , 
5062, Blue, Tabby, Green, Small, Orange, Angry, Yellow, , Fire, 
5063, Pink, Tranquil, Red, Short, Orange, Discerning, Green, , , 
5064, Gray, Crescent, Red, Small, Orange, Open, Green, , Raincloud, 
5065, Gray, Crescent, Pink, Small, Orange, Relaxed, Green, , , Hoodie
5066, Pink, Crescent, Gray, Small, Orange, , , Rose-Colored Glasses, Mohawk (Green), 
5067, Gray, Crescent, Black, Small, Orange, Open, Yellow, , Headband, 
5068, Gray, Brave, Black, Short, Orange, , , Gazelles, , 
5069, Gray, Professor, Black, Small, Orange, Discerning, Yellow, , Bandana, 
5070, Blue, Tabby, Brown, Long, Gray, Side-eye, Yellow, Eyepatch, Skully, 
5071, Gray, Tabby, Purple, Long, Gray, , , 3D Glasses, Halo, 
5072, Yellow, Crescent, White, Short, Gray, , , Jobs Glasses, , 
5073, Yellow, Emperor, Brown, Short, Orange, Angry, White, , , 
5074, Pink, Skeleton, Bone, Short, Skeleton, Relaxed, Skeleton, Eyepatch, Halo, 
5075, Pink, Tranquil, Purple, Long, Gray, Relaxed, Blue, , Space Helmet, 
5076, Pink, Crescent, Red, Small, Orange, Diamond, Epic, , Hero's Cap, Hero's Tunic
5077, Yellow, Tabby, Red, Short, Gray, Side-eye, White, , Backwards Hat, 
5078, Gray, Crescent, Black, Short, Gray, Angry, Yellow, , Halo, 
5079, Gray, Crescent, Red, Small, Gray, Angry, Purple, , , Hoodie
5080, Yellow, Crescent, Black, Small, Gray, , , Rose-Colored Glasses, Fire, 
5081, Gray, Crescent, Purple, Small, Gray, Adorable, Epic, , Hero's Cap, Hero's Tunic
5082, Blue, Professor, Brown, Long, Gray, Open, Purple, , Skully, 
5083, Purple, Crescent, Purple, Short, Gray, Discerning, Gray, , Headband, Punk Jacket
5084, Cosmic Purple, Cosmic, Legendary Crescent, , , , , , , 
5085, Blue, Guardian, Gray, Long, Gray, Side-eye, Green, , , 
5086, Gray, Tranquil, Purple, Small, Orange, Side-eye, Purple, , Grail, 
5087, Purple, Crescent, Blue, Short, Gray, , , Rose-Colored Glasses, Skully, Gold Chain
5088, Green, Crescent, Black, Short, Gray, Discerning, Purple, , Fire, 
5089, Yellow, Professor, Pink, Short, Orange, Angry, Purple, , , Jean Jacket
5090, Green, Crescent, Purple, Small, Gray, Diamond, Epic, , Witch's Hat, Gold Chain
5091, Gray, Tranquil, White, Short, Orange, Relaxed, Red, , , 
5092, Yellow, Crescent, Pink, Short, Gray, Open, Green, , Beanie, 
5093, Yellow, Professor, Red, Short, Gray, , , Gazelles, Bandana, 
5094, Purple, Tabby, Black, Short, Gray, Relaxed, Green, , , 
5095, Green, Stark, Blue, Short, Orange, Angry, Red, , Lincoln, 
5096, Green, Tabby, Purple, Long, Orange, Relaxed, Gray, Eyepatch, , 
5097, Green, Professor, Brown, Small, Orange, Side-eye, Purple, , Bandana, 
5098, Yellow, Crescent, Black, Small, Orange, Discerning, Gray, , Queen's Crown, Gold Chain
5099, Purple, Emperor, Red, Short, Gray, Open, Yellow, , , 
5100, Pink, Stark, Gray, Small, Orange, Open, Purple, , Moon Hat, 
5101, Yellow, Crescent, White, Small, Gray, Angry, Gray, , Moon Hat, 
5102, Purple, Crescent, Blue, Short, Gray, Diamond, Epic, , Wizard's Hat, 
5103, Blue, Emperor, Red, Small, Gray, Adorable, Epic, , , 
5104, Pink, Tabby, Purple, Small, Orange, , , Jobs Glasses, Skully, 
5105, Green, Guardian, Black, Short, Orange, Discerning, Green, , , 
5106, Purple, Crescent, Purple, Small, Orange, Side-eye, Green, , Mohawk (Green), 
5107, Pink, Crescent, Red, Short, Orange, Relaxed, Green, , Moon Hat, 
5108, Gray, Stark, Red, Small, Orange, Adorable, Epic, , Space Helmet, 
5109, Gray, Brave, Brown, Small, Orange, Relaxed, Red, , Grail, 
5110, Purple, Stark, Gray, Small, Orange, Discerning, Purple, , Cowboy Hat, 
5111, Yellow, Crescent, Purple, Short, Orange, Open, Yellow, , Halo, 
5112, Green, Crescent, Pink, Short, Gray, Side-eye, Yellow, , Beanie, 
5113, Gray, Stark, Blue, Small, Gray, , , Gazelles, Halo, 
5114, Blue, Crescent, Red, Small, Gray, Open, Blue, , Tiny Crown, 
5115, Blue, Robot, Metal, Long, Robot, Angry, Robot, , Diamond, 
5116, Pink, Tabby, Red, Small, Gray, Adorable, Epic, , Dancing Flame, 
5117, Yellow, Guardian, Blue, Short, Gray, Relaxed, Green, , , 
5118, Purple, Guardian, Red, Short, Orange, Side-eye, White, , , 
5119, Purple, Crescent, Purple, Short, Orange, Relaxed, Blue, , Diamond, 
5120, Pink, Guardian, Brown, Long, Orange, Open, White, , , 
5121, Blue, Crescent, Gray, Short, Orange, Open, Green, , , 
5122, Pink, Crescent, Black, Small, Gray, Open, Green, , Queen's Crown, Gold Chain
5123, Green, Tranquil, Purple, Short, Orange, Angry, Blue, , Headband, Gold Chain
5124, Yellow, Stark, White, Short, Orange, Angry, Blue, , Cowboy Hat, 
5125, Gray, Brave, Gray, Small, Gray, Relaxed, Red, , Halo, 
5126, Yellow, Crescent, Purple, Short, Orange, Open, White, , , Hoodie
5127, Blue, Crescent, Brown, Small, Gray, Relaxed, Red, , Fire, 
5128, Gray, Crescent, Blue, Short, Gray, Discerning, Green, , Witch's Hat, 
5129, Blue, Stark, Green, Short, Gray, Relaxed, White, , , 
5130, Yellow, Crescent, Gray, Short, Orange, Adorable, Epic, , Witch's Hat, Diamond Necklace
5131, Pink, Stark, Purple, Short, Orange, Side-eye, Blue, , Moon Hat, 
5132, Blue, Tranquil, Brown, Long, Gray, , , Sunglasses, , Punk Jacket
5133, Purple, Crescent, Red, Small, Orange, Side-eye, Red, , Lincoln, 
5134, Yellow, Crescent, White, Short, Gray, Adorable, Epic, , Fire, 
5135, Yellow, Tabby, Black, Small, Orange, Relaxed, Yellow, , Backwards Hat, 
5136, Pink, Guardian, Black, Small, Orange, Angry, Red, Monocle, , 
5137, Blue, Crescent, Red, Long, Orange, Side-eye, Yellow, , Hero's Cap, Hero's Tunic
5138, Green, Crescent, Red, Small, Gray, Open, Blue, , Witch's Hat, 
5139, Blue, Stark, Blue, Small, Orange, Angry, Purple, , Lincoln, Punk Jacket
5140, Gray, Tabby, Green, Long, Gray, Discerning, Red, , , Punk Jacket
5141, Gray, Crescent, Brown, Short, Orange, Open, Yellow, , Captain's Cap, 
5142, Gray, Tabby, Red, Short, Orange, Angry, Gray, , , Hoodie Down
5143, Gray, Crescent, Blue, Small, Gray, Angry, Green, , , 
5144, Yellow, Professor, Black, Short, Gray, Side-eye, Purple, , , 
5145, Green, Crescent, Red, Small, Gray, Relaxed, Blue, , Lincoln, 
5146, Blue, Tranquil, Black, Short, Orange, Open, Green, , Tiara, 
5147, Pink, Brave, White, Long, Orange, Open, White, , Tiara, 
5148, Purple, Guardian, Brown, Small, Orange, , , Aviators, , 
5149, Gray, Tranquil, Gray, Short, Orange, Angry, Green, , Rubber Duck, 
5150, Yellow, Tabby, Black, Short, Orange, Open, Green, , Pirate's Hat, 
5151, Purple, Professor, Green, Short, Orange, Open, Yellow, , , 
5152, Green, Guardian, Gray, Small, Gray, Angry, Yellow, , Space Helmet, 
5153, Green, Tranquil, Pink, Long, Orange, Open, White, , Mohawk (Green), 
5154, Yellow, Sage, Brown, Short, Gray, , , 3D Glasses, Mohawk (Green), 
5155, Blue, Tabby, Brown, Short, Gray, Open, Gray, , Gremplin, 
5156, Green, Stark, Gray, Small, Gray, Discerning, Purple, , Tiny Crown, 
5157, Gray, Stark, Red, Short, Gray, Fire, Epic, , Karate Band, 
5158, Green, Brave, Brown, Small, Gray, Relaxed, Gray, , , 
5159, Blue, Stark, Blue, Small, Orange, Relaxed, Blue, , , 
5160, Blue, Brave, Brown, Short, Orange, Open, Red, , , 
5161, Purple, Guardian, Black, Small, Orange, Side-eye, Purple, , , 
5162, Green, Guardian, Black, Small, Orange, , , Rose-Colored Glasses, Space Helmet, 
5163, Pink, Crescent, Brown, Short, Orange, Angry, Purple, , Flower, 
5164, Pink, Crescent, Brown, Long, Orange, Relaxed, Purple, , Bucket Hat, 
5165, Gray, Stark, White, Small, Orange, Open, White, , Space Helmet, 
5166, Blue, Tabby, Brown, Short, Orange, Open, Blue, , Forest Ranger, 
5167, Pink, Stark, Purple, Small, Orange, Angry, White, , Bandana, 
5168, Purple, Tabby, Gray, Small, Gray, Angry, Yellow, , Queen's Crown, 
5169, Pink, Stark, Gray, Small, Orange, Side-eye, White, , Aviator's Cap, 
5170, Gray, Crescent, Purple, Short, Gray, , , Rose-Colored Glasses, Witch's Hat, Hoodie Down
5171, Purple, Crescent, Blue, Small, Orange, Angry, Red, , Space Helmet, 
5172, Blue, Tabby, Red, Long, Orange, Open, Gray, , Dancing Flame, 
5173, Purple, Tranquil, Purple, Small, Orange, Fire, Epic, , Mohawk (Pink), 
5174, Pink, Crescent, Green, Short, Gray, Discerning, White, , , 
5175, Yellow, Crescent, Gray, Small, Gray, Adorable, Epic, , , 
5176, Green, Crescent, Gray, Short, Gray, Open, Gray, Big Tech, Lincoln, 
5177, Gray, Crescent, Brown, Small, Orange, Open, Purple, , Hero's Cap, Hero's Tunic
5178, Yellow, Crescent, White, Small, Orange, Adorable, Epic, , Cowboy Hat, 
5179, Purple, Crescent, Gray, Small, Orange, Fire, Epic, , Queen's Crown, 
5180, Green, Sage, Pink, Small, Orange, Heart, Epic, , Mohawk (Pink), 
5181, Yellow, Tranquil, Brown, Short, Gray, Open, Green, , , Hoodie Down
5182, Blue, Crescent, Gray, Short, Gray, , , Rose-Colored Glasses, Space Helmet, 
5183, Gray, Tranquil, Red, Small, Gray, Rainbow, Epic, , , 
5184, Gray, Tranquil, Purple, Short, Gray, Adorable, Epic, , Mohawk (Green), 
5185, Purple, Robot, Metal, Long, Robot, Angry, Robot, , Halo, Hoodie Down
5186, Blue, Brave, Red, Short, Gray, Adorable, Epic, , , Gold Chain
5187, Green, Stark, Blue, Long, Orange, Relaxed, White, , Pirate's Hat, 
5188, Gray, Tranquil, Brown, Long, Gray, Angry, Yellow, , Chromie, 
5189, Green, Emperor, Brown, Short, Gray, Open, Yellow, , , 
5190, Yellow, Tabby, Purple, Long, Gray, Side-eye, Yellow, , Backwards Hat, 
5191, Yellow, Crescent, Green, Small, Gray, Side-eye, Gray, , Tiny Crown, 
5192, Blue, Crescent, Red, Small, Orange, Side-eye, Blue, , Beanie, 
5193, Blue, Crescent, Pink, Short, Orange, Side-eye, Purple, , Durag, 
5194, Yellow, Tabby, Brown, Short, Gray, Relaxed, Green, , , 
5195, Purple, Tabby, White, Short, Gray, Open, Green, , , 
5196, Yellow, Emperor, Brown, Short, Orange, Open, Green, , , 
5197, Green, Crescent, White, Short, Orange, Open, Green, , Pirate's Hat, Punk Jacket
5198, Gray, Crescent, Pink, Short, Orange, Angry, Yellow, , Forest Ranger, 
5199, Purple, Crescent, Red, Small, Orange, Moon, Epic, , , Hoodie
5200, Yellow, Tranquil, Red, Small, Orange, Side-eye, Gray, , , 
5201, Green, Crescent, Blue, Short, Gray, Side-eye, Red, , Witch's Hat, Hoodie Down
5202, Blue, Guardian, Purple, Short, Orange, Open, Yellow, , Crescent Talisman, 
5203, Yellow, Crescent, Brown, Small, Gray, Open, White, , Pirate's Hat, 
5204, Yellow, Crescent, Green, Long, Gray, Open, Blue, , Wizard's Hat, 
5205, Yellow, Emperor, Black, Small, Orange, Angry, Purple, , , Gold Chain
5206, Purple, Crescent, Black, Long, Orange, , , Sunglasses, Mohawk (Pink), 
5207, Pink, Emperor, Brown, Small, Gray, Open, Red, , Headphones, 
5208, Pink, Crescent, Brown, Short, Orange, , , Sunglasses, Moon Hat, 
5209, Blue, Professor, Brown, Small, Orange, Relaxed, Gray, , Skully, 
5210, Gray, Crescent, Black, Small, Orange, Open, Red, , Witch's Hat, 
5211, Blue, Sage, Blue, Short, Orange, Side-eye, Gray, , Raincloud, 
5212, Purple, Stark, Blue, Small, Gray, Discerning, White, , Karate Band, 
5213, Yellow, Brave, Purple, Short, Gray, Angry, White, , Karate Band, 
5214, Gray, Stark, Blue, Small, Orange, , , Jobs Glasses, Lincoln, 
5215, Gray, Stark, Purple, Short, Orange, Discerning, Purple, , Lincoln, 
5216, Purple, Crescent, Pink, Long, Orange, Side-eye, White, , Beanie, 
5217, Gray, Tabby, Gray, Long, Orange, Relaxed, Gray, , Backwards Hat, 
5218, Purple, Stark, Black, Short, Orange, Side-eye, Blue, , Halo, 
5219, Pink, Golden, Legendary Professor, Small, Golden, Open, Golden, Big Tech, , 
5220, Purple, Crescent, Green, Short, Gray, Adorable, Epic, , Pirate's Hat, 
5221, Gray, Guardian, White, Short, Gray, Open, Red, , Tiara, 
5222, Yellow, Tabby, White, Short, Gray, Heart, Epic, , Space Helmet, 
5223, Yellow, Crescent, Gray, Small, Orange, Discerning, Red, , Mohawk (Green), 
5224, Blue, Brave, White, Short, Orange, Side-eye, Green, , Bandana, 
5225, Gray, Crescent, Blue, Long, Gray, Relaxed, Red, , Pirate's Hat, 
5226, Purple, Emperor, White, Short, Orange, Discerning, White, , Bandana, 
5227, Green, Brave, Purple, Short, Gray, , , Jobs Glasses, Raincloud, 
5228, Blue, Emperor, Blue, Short, Orange, Side-eye, Blue, , , Diamond Necklace
5229, Pink, Stark, Brown, Short, Gray, Angry, Yellow, , Forest Ranger, 
5230, Purple, Crescent, Red, Long, Gray, Adorable, Epic, Eyepatch, Bucket Hat, 
5231, Purple, Tranquil, Red, Small, Gray, Open, Yellow, , Tiny Crown, 
5232, Yellow, Brave, Black, Small, Orange, Angry, Green, , Halo, 
5233, Pink, Stark, Red, Small, Gray, , , Gazelles, Lincoln, 
5234, Blue, Tranquil, Gray, Short, Gray, Side-eye, White, , Mohawk (Green), 
5235, Yellow, Guardian, Gray, Small, Orange, Heart, Epic, Monocle, , 
5236, Green, Skeleton, Bone, Short, Skeleton, Adorable, Epic, , Chromie, 
5237, Pink, Crescent, Blue, Small, Orange, Open, White, , Aviator's Cap, 
5238, Gray, Crescent, Gray, Long, Orange, Open, Red, , Wizard's Hat, 
5239, Yellow, Crescent, Gray, Short, Orange, Side-eye, Red, , Hero's Cap, Hero's Tunic
5240, Yellow, Crescent, Black, Small, Orange, Open, Yellow, , Aviator's Cap, 
5241, Gray, Tranquil, Brown, Small, Orange, Open, Blue, , Tiny Crown, Jean Jacket
5242, Pink, Stark, Green, Small, Orange, Discerning, Red, , Karate Band, 
5243, Purple, Professor, Blue, Short, Gray, Discerning, Red, Monocle, , 
5244, Green, Stark, Blue, Small, Gray, Open, Blue, , Fire, 
5245, Green, Crescent, Black, Small, Orange, Angry, Purple, , Backwards Hat, 
5246, Gray, Tabby, Brown, Short, Orange, Discerning, Red, , , 
5247, Pink, Stark, Gray, Short, Gray, Discerning, Blue, , Fire, 
5248, Yellow, Guardian, Brown, Short, Orange, Heart, Epic, , Cowboy Hat, 
5249, Yellow, Crescent, Blue, Short, Orange, Angry, Gray, , Wizard's Hat, 
5250, Blue, Crescent, Gray, Short, Orange, Open, Red, , , Hoodie
5251, Gray, Stark, Red, Small, Gray, Side-eye, White, , Bandana, Gold Chain
5252, Gray, Crescent, Purple, Long, Orange, Side-eye, Gray, Eyepatch, Beanie, 
5253, Blue, Crescent, Brown, Small, Orange, Side-eye, Green, , Mohawk (Green), 
5254, Green, Robot, Metal, Short, Robot, , , Visor, , 
5255, Pink, Crescent, Black, Short, Gray, Angry, Blue, , , 
5256, Yellow, Tabby, Purple, Long, Orange, , , Black-rimmed Glasses, Tiny Crown, 
5257, Yellow, Brave, Red, Small, Orange, Discerning, Red, , , 
5258, Green, Tranquil, Black, Short, Gray, Open, White, , Space Helmet, 
5259, Yellow, Guardian, Red, Small, Orange, Side-eye, White, , Space Helmet, 
5260, Green, Stark, Purple, Small, Gray, Relaxed, White, , Rubber Duck, 
5261, Gray, Crescent, White, Small, Gray, Angry, Purple, , Karate Band, Gold Chain
5262, Gray, Tabby, Brown, Short, Gray, , , Rose-Colored Glasses, Skully, 
5263, Green, Stark, Red, Short, Gray, Diamond, Epic, , Lincoln, Punk Jacket
5264, Pink, Tranquil, Brown, Small, Orange, Open, Red, , Crescent Talisman, 
5265, Pink, Stark, Gray, Small, Gray, Open, Gray, , , 
5266, Green, Brave, Green, Long, Orange, Open, White, , Raincloud, 
5267, Blue, Guardian, Red, Short, Gray, Open, Blue, , Bow, 
5268, Pink, Tranquil, White, Short, Gray, Angry, Red, , , 
5269, Purple, Crescent, Purple, Long, Gray, Open, Yellow, , , Diamond Necklace
5270, Gray, Crescent, Gray, Small, Orange, Open, Gray, , Forest Ranger, 
5271, Purple, Tranquil, Red, Small, Gray, Open, Green, , , 
5272, Yellow, Sage, Green, Small, Gray, Rainbow, Epic, , , 
5273, Gray, Guardian, Blue, Small, Orange, Relaxed, Gray, , Space Helmet, 
5274, Gray, Crescent, White, Short, Gray, Angry, Blue, , Headphones, 
5275, Purple, Tranquil, Black, Small, Gray, Open, Red, , Headphones, 
5276, Yellow, Crescent, Brown, Long, Orange, Relaxed, Blue, , Beanie, 
5277, Gray, Stark, Red, Short, Gray, Open, Green, , Pirate's Hat, 
5278, Gray, Stark, Gray, Short, Orange, , , Sunglasses, Headband, 
5279, Gray, Tabby, Pink, Short, Orange, Open, Gray, , , 
5280, Pink, Tranquil, Brown, Short, Gray, Relaxed, Red, Monocle, , 
5281, Blue, Stark, Gray, Short, Orange, Open, Gray, , Queen's Crown, 
5282, Blue, Crescent, Gray, Short, Orange, Discerning, Green, , , Bomber Jacket
5283, Blue, Crescent, Black, Short, Gray, Angry, White, , Durag, 
5284, Green, Professor, Pink, Long, Gray, Open, Blue, Big Tech, Halo, 
5285, Blue, Crescent, Brown, Short, Gray, Discerning, White, , Beanie, Diamond Necklace
5286, Yellow, Guardian, Purple, Small, Orange, Angry, White, , , 
5287, Gray, Crescent, Purple, Short, Orange, Discerning, Green, , Tiara, 
5288, Gray, Stark, Red, Short, Orange, Open, White, , , 
5289, Gray, Crescent, Blue, Short, Orange, Angry, Blue, , Lincoln, Diamond Necklace
5290, Blue, Crescent, Black, Long, Orange, Open, Green, , , Hoodie
5291, Blue, Stark, Purple, Short, Orange, Discerning, White, , Fire, 
5292, Green, Brave, White, Short, Orange, , , 3D Glasses, , Bomber Jacket
5293, Gray, Stark, Blue, Long, Gray, Relaxed, White, , Aviator's Cap, 
5294, Green, Tabby, Pink, Short, Gray, Discerning, Yellow, , Forest Ranger, 
5295, Green, Crescent, Brown, Short, Gray, Angry, Purple, , Forest Ranger, 
5296, Gray, Emperor, Gray, Small, Orange, Relaxed, Blue, , , 
5297, Gray, Tranquil, Gray, Long, Orange, Discerning, Purple, , Tiara, Jean Jacket
5298, Purple, Crescent, Red, Short, Gray, Diamond, Epic, , , Hoodie
5299, Pink, Stark, Green, Short, Gray, Adorable, Epic, , Aviator's Cap, 
5300, Pink, Stark, Purple, Short, Gray, , , 3D Glasses, Fire, 
5301, Gray, Stark, Red, Short, Orange, Side-eye, Blue, , , 
5302, Purple, Brave, Red, Small, Gray, Discerning, Green, , Skully, 
5303, Blue, Guardian, Green, Small, Gray, Side-eye, Red, , Dancing Flame, 
5304, Yellow, Crescent, Brown, Short, Gray, Side-eye, Green, , Aviator's Cap, 
5305, Blue, Guardian, Blue, Short, Orange, Angry, Green, Eyepatch, Tiara, 
5306, Gray, Tranquil, Brown, Small, Gray, Adorable, Epic, , Space Helmet, 
5307, Green, Tabby, Gray, Short, Orange, Moon, Epic, , Headband, 
5308, Blue, Crescent, White, Small, Orange, Open, Green, , , Hoodie Down
5309, Purple, Brave, Gray, Small, Orange, Rainbow, Epic, , , 
5310, Gray, Brave, White, Small, Gray, Relaxed, White, , Bow, 
5311, Green, Professor, Black, Small, Gray, Side-eye, Blue, , , 
5312, Green, Professor, Red, Short, Gray, Discerning, Gray, , , Jean Jacket
5313, Green, Tranquil, Blue, Small, Gray, Relaxed, Blue, , Mohawk (Pink), 
5314, Pink, Crescent, Brown, Short, Orange, Open, Yellow, , Mohawk (Pink), 
5315, Green, Crescent, Brown, Small, Orange, , , Rose-Colored Glasses, Bucket Hat, 
5316, Yellow, Professor, White, Short, Gray, Side-eye, Green, , , 
5317, Pink, Emperor, Black, Small, Gray, Side-eye, White, Eyepatch, Dancing Flame, 
5318, Purple, Robot, Metal, Long, Robot, Angry, Robot, , Flower, Punk Jacket
5319, Green, Crescent, Gray, Long, Orange, Open, Yellow, , Bandana, 
5320, Pink, Crescent, Purple, Long, Orange, Heart, Epic, , Witch's Hat, 
5321, Gray, Stark, Blue, Short, Orange, Side-eye, Gray, , Aviator's Cap, Gold Chain
5322, Yellow, Tabby, Black, Short, Gray, Open, Green, , Queen's Crown, 
5323, Yellow, Crescent, Blue, Short, Orange, Open, Purple, , Durag, 
5324, Pink, Tranquil, Purple, Long, Orange, Side-eye, Green, , Queen's Crown, 
5325, Gray, Crescent, White, Small, Orange, , , Rose-Colored Glasses, Tiara, 
5326, Green, Tranquil, Gray, Small, Orange, , , Visor, , Hoodie Down
5327, Gray, Crescent, Brown, Long, Orange, Relaxed, White, , Witch's Hat, Gold Chain
5328, Green, Guardian, White, Short, Gray, Open, Gray, , Cowboy Hat, 
5329, Yellow, Tabby, Brown, Small, Gray, , , Jobs Glasses, , 
5330, Green, Stark, Red, Short, Orange, Diamond, Epic, , Moon Hat, 
5331, Blue, Brave, Pink, Small, Gray, , , Aviators, , Punk Jacket
5332, Gray, Robot, Metal, Short, Robot, Angry, Robot, , Bucket Hat, Hoodie Down
5333, Purple, Tabby, Gray, Small, Gray, Open, Gray, , Backwards Hat, 
5334, Pink, Crescent, Pink, Short, Gray, Adorable, Epic, , , 
5335, Purple, Tranquil, Green, Small, Gray, Open, Green, , , 
5336, Blue, Stark, White, Short, Orange, Open, White, , Mohawk (Pink), Punk Jacket
5337, Purple, Crescent, Red, Long, Gray, Relaxed, Green, , Pirate's Hat, 
5338, Blue, Tabby, Gray, Small, Gray, Relaxed, Red, , Crescent Talisman, 
5339, Pink, Crescent, Gray, Short, Gray, Side-eye, Purple, , Fire, 
5340, Pink, Guardian, Purple, Short, Orange, Open, Red, , Queen's Crown, 
5341, Green, Tranquil, Gray, Short, Gray, Open, White, Eyepatch, , 
5342, Blue, Stark, Black, Short, Gray, Side-eye, Green, , Moon Hat, 
5343, Yellow, Guardian, Pink, Long, Orange, , , Aviators, , 
5344, Blue, Guardian, Red, Small, Orange, Side-eye, Green, , Cowboy Hat, 
5345, Green, Crescent, Red, Short, Orange, , , 3D Glasses, Mohawk (Green), 
5346, Pink, Stark, Red, Long, Orange, Side-eye, Blue, , Skully, 
5347, Gray, Professor, Brown, Short, Gray, Side-eye, Red, , Crescent Talisman, 
5348, Green, Crescent, Blue, Short, Orange, Open, Red, , Aviator's Cap, 
5349, Pink, Crescent, Gray, Long, Gray, , , Gazelles, , 
5350, Purple, Crescent, Brown, Short, Gray, Open, Blue, , Bandana, 
5351, Gray, Crescent, Gray, Short, Orange, Angry, Purple, , , Hoodie
5352, Blue, Stark, Gray, Small, Orange, Open, White, , Moon Hat, 
5353, Gray, Crescent, Purple, Long, Orange, Moon, Epic, , Lincoln, 
5354, Gray, Crescent, Gray, Small, Gray, Side-eye, Yellow, , Fire, 
5355, Pink, Crescent, Purple, Short, Gray, Relaxed, Gray, , , Hoodie
5356, Pink, Crescent, Black, Small, Orange, Discerning, Purple, , Captain's Cap, 
5357, Gray, Crescent, White, Long, Gray, , , Gazelles, Beanie, 
5358, Pink, Crescent, Red, Small, Gray, , , Jobs Glasses, , 
5359, Blue, Crescent, Gray, Small, Gray, Angry, Red, , Diamond, 
5360, Gray, Stark, Black, Small, Gray, Discerning, White, , Halo, 
5361, Green, Stark, Purple, Short, Orange, Discerning, Blue, , Captain's Cap, 
5362, Yellow, Robot, Metal, Long, Robot, , , Visor, Chromie, 
5363, Pink, Tabby, White, Short, Orange, Relaxed, Gray, , Tiny Crown, 
5364, Yellow, Robot, Metal, Short, Robot, Open, Robot, , Cowboy Hat, Punk Jacket
5365, Yellow, Crescent, Blue, Short, Gray, Angry, Yellow, , Fire, 
5366, Purple, Crescent, Pink, Short, Gray, Angry, White, , Captain's Cap, 
5367, Yellow, Tranquil, Green, Small, Gray, Open, Purple, , Karate Band, Gold Chain
5368, Pink, Brave, White, Small, Gray, Adorable, Epic, Monocle, Grail, 
5369, Pink, Crescent, Blue, Small, Gray, Open, Gray, , Moon Hat, 
5370, Green, Skeleton, Bone, Small, Skeleton, Open, Skeleton, Eyepatch, Gremplin, 
5371, Blue, Crescent, Gray, Short, Orange, Relaxed, Gray, , Queen's Crown, 
5372, Pink, Crescent, Blue, Small, Orange, , , Visor, Beanie, 
5373, Gray, Stark, White, Long, Orange, , , Visor, , 
5374, Green, Guardian, Gray, Short, Orange, Relaxed, Blue, , Cowboy Hat, 
5375, Gray, Crescent, Red, Small, Gray, Angry, Green, , Grail, 
5376, Green, Professor, Gray, Long, Gray, , , Rose-Colored Glasses, , 
5377, Green, Professor, Purple, Short, Gray, Open, Blue, , , 
5378, Green, Tranquil, Black, Small, Orange, , , Jobs Glasses, Space Helmet, 
5379, Yellow, Crescent, Purple, Short, Gray, Open, Green, , Aviator's Cap, 
5380, Pink, Tabby, Gray, Short, Gray, Open, Yellow, , , Gold Chain
5381, Yellow, Stark, White, Short, Gray, , , Sunglasses, Space Helmet, 
5382, Green, Skeleton, Bone, Long, Skeleton, Relaxed, Skeleton, , Mohawk (Green), 
5383, Blue, Tabby, Red, Short, Gray, , , Rose-Colored Glasses, Bow, 
5384, Purple, Tranquil, Blue, Small, Orange, Open, Yellow, , Grail, 
5385, Purple, Tabby, Purple, Short, Orange, Side-eye, Yellow, , Space Helmet, 
5386, Purple, Tranquil, Black, Short, Orange, Heart, Epic, , , 
5387, Gray, Tabby, Brown, Small, Orange, Moon, Epic, Eyepatch, , 
5388, Blue, Crescent, Blue, Short, Gray, Side-eye, Gray, , , 
5389, Green, Stark, Red, Long, Orange, , , Sunglasses, Halo, 
5390, Pink, Crescent, Brown, Small, Gray, , , Black-rimmed Glasses, Wizard's Hat, 
5391, Blue, Crescent, Brown, Short, Gray, Open, White, , , 
5392, Purple, Tranquil, Brown, Short, Orange, Angry, Red, , Gremplin, 
5393, Green, Crescent, Black, Small, Orange, Rainbow, Epic, , Halo, 
5394, Gray, Tabby, Red, Short, Orange, Moon, Epic, , , Hoodie Down
5395, Blue, Crescent, Green, Short, Gray, Discerning, Red, , Hero's Cap, Hero's Tunic
5396, Purple, Crescent, Brown, Short, Gray, Side-eye, White, , Fire, Hoodie Down
5397, Green, Tranquil, Purple, Small, Gray, Discerning, Red, , , 
5398, Green, Professor, Red, Long, Orange, Side-eye, Red, , Karate Band, 
5399, Green, Tabby, Brown, Short, Gray, , , Visor, Backwards Hat, 
5400, Gray, Crescent, Black, Short, Gray, Fire, Epic, , , Hoodie Down
5401, Yellow, Guardian, Purple, Long, Gray, Side-eye, Red, Eyepatch, , 
5402, Green, Stark, Brown, Small, Orange, Rainbow, Epic, , Aviator's Cap, 
