7204, Pink, Crescent, Red, Small, Orange, Side-eye, Green, , Fire, 
7205, Blue, Crescent, Purple, Long, Gray, Relaxed, White, , , 
7206, Pink, Crescent, Black, Long, Gray, Open, Purple, , Durag, 
7207, Green, Stark, Red, Short, Gray, Angry, Yellow, , Space Helmet, 
7208, Yellow, Professor, Gray, Small, Orange, Discerning, White, , , 
7209, Yellow, Brave, Gray, Small, Orange, Fire, Epic, , Raincloud, 
7210, Purple, Crescent, Black, Short, Orange, , , 3D Glasses, Captain's Cap, Gold Chain
7211, Blue, Tranquil, White, Short, Gray, Angry, Gray, , , 
7212, Yellow, Tranquil, Pink, Short, Orange, Relaxed, Green, , Gremplin, 
7213, Purple, Stark, Brown, Short, Orange, Angry, White, , Moon Hat, 
7214, Gray, Tranquil, Green, Short, Orange, Relaxed, Yellow, , Karate Band, 
7215, Pink, Tranquil, Purple, Small, Orange, Open, White, , Mohawk (Green), 
7216, Green, Robot, Metal, Small, Robot, Open, Robot, , Skully, Punk Jacket
7217, Purple, Crescent, Red, Small, Orange, , , Rose-Colored Glasses, Mohawk (Green), 
7218, Yellow, Guardian, Pink, Small, Orange, Discerning, White, , , 
7219, Purple, Tabby, Blue, Long, Orange, Diamond, Epic, , Gremplin, 
7220, Green, Guardian, White, Small, Orange, Open, Blue, , Space Helmet, 
7221, Purple, Crescent, Red, Short, Gray, , , Gazelles, Witch's Hat, 
7222, Yellow, Stark, Red, Small, Gray, Discerning, Purple, , , 
7223, Gray, Brave, Black, Small, Gray, Rainbow, Epic, , Bow, 
7224, Gray, Crescent, Red, Small, Orange, Side-eye, Gray, , , 
7225, Green, Tabby, Red, Short, Gray, Relaxed, Purple, , , 
7226, Gray, Tranquil, White, Long, Gray, Discerning, White, , Mohawk (Green), Diamond Necklace
7227, Yellow, Sage, Brown, Small, Orange, Relaxed, Yellow, , Grail, 
7228, Yellow, Tabby, Gray, Small, Orange, Discerning, White, , Fire, Gold Chain
7229, Green, Brave, Red, Short, Orange, Adorable, Epic, , Skully, 
7230, Pink, Tabby, Red, Short, Orange, Diamond, Epic, , Crescent Talisman, 
7231, Gray, Brave, Blue, Short, Gray, , , Aviators, Skully, 
7232, Green, Emperor, White, Short, Gray, Angry, Gray, , , 
7233, Gray, Crescent, Red, Short, Orange, Diamond, Epic, , Witch's Hat, 
7234, Green, Crescent, Red, Small, Gray, Fire, Epic, , Mohawk (Green), 
7235, Blue, Crescent, Pink, Small, Orange, Side-eye, Red, , Beanie, 
7236, Yellow, Emperor, Red, Short, Gray, Side-eye, Red, , , 
7237, Blue, Crescent, Brown, Short, Orange, Discerning, White, , Diamond, 
7238, Pink, Guardian, Purple, Short, Gray, , , Aviators, Space Helmet, 
7239, Gray, Golden, Legendary Crescent, Short, Golden, Relaxed, Golden, , Pirate's Hat, 
7240, Blue, Crescent, White, Small, Gray, Side-eye, Gray, , Witch's Hat, 
7241, Purple, Tabby, White, Short, Orange, Relaxed, Yellow, , Queen's Crown, 
7242, Blue, Brave, Red, Long, Orange, Open, Green, , Dancing Flame, 
7243, Pink, Tranquil, Blue, Short, Orange, Relaxed, Purple, , Space Helmet, 
7244, Green, Crescent, Brown, Small, Gray, Discerning, Blue, , Beanie, 
7245, Blue, Brave, Gray, Long, Orange, Side-eye, Gray, , Karate Band, 
7246, Pink, Robot, Metal, Short, Robot, Angry, Robot, , Chromie, Hoodie Down
7247, Pink, Stark, Black, Short, Orange, Relaxed, Blue, , Aviator's Cap, 
7248, Blue, Crescent, Green, Small, Gray, Relaxed, Yellow, , Moon Hat, 
7249, Green, Tabby, Purple, Short, Orange, Open, Green, , Headphones, 
7250, Purple, Brave, Purple, Small, Gray, Side-eye, Red, , Grail, 
7251, Gray, Crescent, Red, Small, Gray, Open, Purple, , Mohawk (Green), 
7252, Pink, Crescent, Blue, Small, Orange, Rainbow, Epic, , Rubber Duck, 
7253, Gray, Ruby Skeleton, Legendary Bone, Small, Ruby, Angry, Skeleton, , Skully, 
7254, Gray, Stark, Blue, Small, Gray, Open, Purple, , Moon Hat, 
7255, Purple, Tranquil, Red, Small, Gray, Angry, Purple, , , 
7256, Blue, Crescent, Gray, Small, Orange, Open, Yellow, , , Punk Jacket
7257, Green, Brave, Red, Small, Orange, , , Sunglasses, , 
7258, Yellow, Tabby, Red, Short, Orange, Open, White, , Flower, 
7259, Green, Ruby Skeleton, Legendary Bone, Small, Ruby, Open, Skeleton, Sunglasses, , 
7260, Gray, Crescent, Gray, Small, Gray, Open, Green, , Witch's Hat, 
7261, Pink, Skeleton, Bone, Short, Skeleton, , , Sunglasses, Cowboy Hat, 
7262, Gray, Professor, Purple, Small, Orange, , , 3D Glasses, Halo, 
7263, Green, Crescent, Blue, Long, Gray, Discerning, Gray, , Mohawk (Green), 
7264, Blue, Crescent, Red, Long, Gray, Open, White, , Pirate's Hat, 
7265, Green, Tranquil, Red, Small, Gray, , , Aviators, , 
7266, Purple, Crescent, Red, Small, Orange, , , Black-rimmed Glasses, Lincoln, 
7267, Yellow, Brave, White, Small, Gray, Relaxed, Blue, , Grail, 
7268, Blue, Tranquil, Purple, Small, Gray, Side-eye, Gray, , , 
7269, Blue, Tabby, Black, Small, Gray, Side-eye, Purple, , Flower, 
7270, Yellow, Stark, Green, Small, Gray, Open, White, , Aviator's Cap, 
7271, Cosmic Purple, Cosmic, Legendary Emperor, , , , , , , 
7272, Green, Guardian, Red, Small, Gray, Diamond, Epic, Eyepatch, , 
7273, Gray, Guardian, White, Short, Orange, Side-eye, Red, , , 
7274, Blue, Golden, Legendary Crescent, Small, Golden, Open, Golden, , Durag, 
7275, Green, Tranquil, Green, Short, Orange, Side-eye, Gray, , Headphones, 
7276, Pink, Stark, Gray, Short, Gray, Open, White, , Cowboy Hat, Jean Jacket
7277, Blue, Tranquil, Red, Short, Gray, Angry, Yellow, , Skully, 
7278, Pink, Tabby, White, Small, Orange, Discerning, Green, , Pirate's Hat, 
7279, Yellow, Stark, Purple, Small, Gray, Relaxed, Blue, , Moon Hat, Jean Jacket
7280, Pink, Guardian, Brown, Long, Gray, Discerning, Purple, , , 
7281, Pink, Brave, Red, Small, Orange, Discerning, Yellow, , Skully, 
7282, Purple, Crescent, Brown, Long, Gray, Adorable, Epic, , , Hoodie
7283, Pink, Professor, Black, Long, Gray, Discerning, Red, , , 
7284, Purple, Crescent, Green, Small, Gray, Angry, White, , Wizard's Hat, 
7285, Blue, Stark, Black, Small, Gray, Discerning, Blue, , , 
7286, Purple, Professor, Brown, Small, Orange, Relaxed, Blue, , Headband, 
7287, Yellow, Crescent, Purple, Short, Gray, Side-eye, Purple, , Mohawk (Pink), 
7288, Gray, Crescent, Purple, Long, Gray, Open, Yellow, , , 
7289, Gray, Tabby, White, Short, Gray, Adorable, Epic, , Rubber Duck, 
7290, Blue, Crescent, Purple, Small, Gray, , , Gazelles, Witch's Hat, 
7291, Gray, Tranquil, Red, Short, Orange, Open, White, , Halo, 
7292, Yellow, Tranquil, Purple, Small, Orange, Moon, Epic, , , 
7293, Yellow, Crescent, Black, Long, Orange, Discerning, Red, , Mohawk (Pink), 
7294, Yellow, Crescent, White, Small, Orange, Discerning, Red, , Bucket Hat, 
7295, Yellow, Crescent, Gray, Small, Gray, Open, Blue, Half-moon Spectacles, Fire, 
7296, Pink, Tabby, Green, Short, Gray, Angry, White, , Space Helmet, 
7297, Pink, Crescent, Brown, Small, Orange, Open, Yellow, , Witch's Hat, 
7298, Purple, Stark, Gray, Small, Gray, Open, Yellow, , Raincloud, Hoodie Down
7299, Yellow, Guardian, Red, Short, Gray, Discerning, Yellow, , , 
7300, Purple, Tranquil, Gray, Long, Gray, Rainbow, Epic, , Flower, 
7301, Blue, Crescent, Red, Small, Orange, , , Visor, Mohawk (Pink), 
7302, Purple, Crescent, Brown, Long, Orange, Angry, Purple, Eyepatch, Raincloud, Gold Chain
7303, Blue, Crescent, Purple, Short, Orange, Relaxed, Yellow, , Beanie, 
7304, Gray, Crescent, Brown, Small, Orange, Open, Green, , Hero's Cap, Hero's Tunic
7305, Gray, Crescent, Blue, Small, Gray, Open, White, , Headband, 
7306, Purple, Professor, Gray, Small, Gray, Open, Purple, Monocle, Skully, 
7307, Pink, Tabby, Purple, Long, Gray, Angry, Green, , , 
7308, Pink, Crescent, Black, Small, Orange, Open, Purple, , Beanie, 
7309, Gray, Crescent, Blue, Small, Orange, Relaxed, Purple, , Lincoln, 
7310, Yellow, Crescent, Gray, Small, Orange, Discerning, Blue, , , 
7311, Pink, Tabby, Red, Long, Orange, Open, Yellow, , Pirate's Hat, 
7312, Gray, Brave, White, Long, Orange, Discerning, Gray, , , 
7313, Gray, Crescent, Black, Small, Gray, Open, Purple, , Wizard's Hat, 
7314, Gray, Crescent, Red, Small, Orange, , , Sunglasses, , Bomber Jacket
7315, Pink, Guardian, Purple, Short, Gray, Open, White, Monocle, , 
7316, Pink, Crescent, Gray, Small, Gray, Open, Green, , Wizard's Hat, Jean Jacket
7317, Blue, Stark, White, Small, Gray, Open, Red, , Raincloud, 
7318, Gray, Crescent, Red, Small, Orange, Diamond, Epic, , Headband, 
7319, Purple, Tranquil, Gray, Long, Orange, Open, Gray, , Crescent Talisman, Jean Jacket
7320, Purple, Crescent, White, Long, Gray, Discerning, Gray, , , 
7321, Gray, Tabby, Gray, Short, Gray, Side-eye, Purple, , Halo, 
7322, Pink, Professor, Gray, Long, Gray, , , Gazelles, , 
7323, Yellow, Crescent, White, Small, Orange, , , Black-rimmed Glasses, Tiara, 
7324, Pink, Stark, Brown, Long, Gray, Side-eye, Green, , , 
7325, Blue, Crescent, Red, Short, Orange, Angry, Blue, , Tiara, 
7326, Purple, Crescent, Pink, Small, Orange, Open, White, , Headband, Diamond Necklace
7327, Green, Crescent, Red, Short, Gray, Relaxed, White, , Moon Hat, 
7328, Green, Professor, White, Small, Gray, Relaxed, Red, , Karate Band, 
7329, Blue, Stark, Gray, Long, Orange, Angry, White, , Moon Hat, 
7330, Gray, Tabby, Gray, Small, Orange, Relaxed, White, , Raincloud, 
7331, Green, Stark, Blue, Small, Orange, Angry, Blue, , , 
7332, Gray, Professor, Pink, Long, Orange, Angry, White, , , 
7333, Purple, Crescent, White, Short, Gray, Relaxed, Yellow, , Beanie, 
7334, Gray, Crescent, White, Long, Orange, Relaxed, Green, , Mohawk (Green), 
7335, Blue, Tranquil, Purple, Short, Orange, Relaxed, Purple, , Halo, 
7336, Green, Sage, Brown, Small, Orange, Angry, Green, , Mohawk (Pink), 
7337, Blue, Brave, Brown, Small, Orange, Open, Purple, , Tiara, 
7338, Blue, Tranquil, Gray, Short, Gray, , , Gazelles, Mohawk (Pink), 
7339, Blue, Brave, Pink, Long, Orange, Angry, Gray, , Tiny Crown, 
7340, Pink, Brave, Black, Short, Gray, Moon, Epic, , Diamond, 
7341, Pink, Stark, Gray, Small, Orange, Open, Gray, Eyepatch, Mohawk (Green), 
7342, Yellow, Guardian, Purple, Small, Gray, Open, Blue, , Bandana, Punk Jacket
7343, Blue, Crescent, Gray, Short, Orange, , , Gazelles, Mohawk (Pink), 
7344, Blue, Crescent, Purple, Small, Gray, Adorable, Epic, , Mohawk (Green), 
7345, Yellow, Brave, Purple, Short, Gray, Discerning, Purple, , , 
7346, Blue, Professor, Brown, Long, Orange, Angry, Blue, , , 
7347, Purple, Stark, Brown, Small, Orange, Adorable, Epic, , Chromie, 
7348, Pink, Stark, Blue, Short, Gray, Relaxed, Yellow, , Headband, 
7349, Yellow, Stark, Red, Small, Orange, Angry, Yellow, , Tiny Crown, 
7350, Gray, Crescent, Purple, Long, Gray, Angry, Red, , Halo, 
7351, Blue, Crescent, Brown, Long, Gray, Open, Blue, , Beanie, Jean Jacket
7352, Glitch Red, Glitch, Legendary Emperor, , , , , , , 
7353, Green, Tabby, Black, Short, Gray, Relaxed, Gray, , Tiny Crown, 
7354, Gray, Brave, Pink, Long, Orange, Open, Gray, , Bow, Punk Jacket
7355, Yellow, Crescent, Purple, Small, Orange, Rainbow, Epic, , Durag, Jean Jacket
7356, Yellow, Tabby, White, Short, Orange, Side-eye, Red, , , Diamond Necklace
7357, Gray, Tranquil, Red, Long, Orange, Discerning, Blue, , Space Helmet, 
7358, Blue, Stark, Red, Small, Orange, Open, Blue, Monocle, Moon Hat, 
7359, Purple, Stark, Green, Long, Gray, Open, Green, Eyepatch, , 
7360, Yellow, Crescent, Red, Small, Gray, Open, Gray, , Tiny Crown, 
7361, Yellow, Crescent, Gray, Small, Gray, Relaxed, Blue, , Wizard's Hat, 
7362, Yellow, Guardian, Brown, Short, Orange, Angry, Purple, Eyepatch, , 
7363, Yellow, Tranquil, Blue, Short, Orange, Discerning, White, , Grail, 
7364, Blue, Crescent, Blue, Short, Gray, Relaxed, Purple, , Bucket Hat, 
7365, Blue, Tabby, Blue, Short, Orange, Open, Yellow, , , 
7366, Blue, Tranquil, Brown, Short, Orange, , , Aviators, , 
7367, Gray, Crescent, Purple, Small, Gray, Relaxed, Green, , Cowboy Hat, 
7368, Purple, Professor, Black, Short, Gray, Angry, Red, , , 
7369, Blue, Sage, White, Small, Gray, Open, Red, , Bandana, 
7370, Green, Stark, Gray, Small, Orange, Side-eye, Purple, , Queen's Crown, Gold Chain
7371, Gray, Crescent, Purple, Short, Orange, Open, White, , Bucket Hat, 
7372, Yellow, Emperor, Blue, Long, Orange, Open, Gray, , , 
7373, Green, Crescent, Purple, Long, Gray, Discerning, Yellow, , Durag, 
7374, Yellow, Crescent, Brown, Small, Gray, Side-eye, Blue, , Beanie, 
7375, Gray, Emperor, Brown, Long, Orange, Relaxed, Purple, , , Gold Chain
7376, Pink, Tranquil, White, Short, Orange, Open, Gray, , Space Helmet, 
7377, Blue, Brave, Brown, Short, Gray, Open, Green, , , 
7378, Blue, Professor, Purple, Short, Orange, Relaxed, Green, , , 
7379, Gray, Crescent, Red, Short, Orange, Open, Green, , Aviator's Cap, 
7380, Pink, Professor, White, Short, Orange, Angry, Blue, , Halo, 
7381, Purple, Tranquil, Brown, Small, Orange, Open, Blue, , Bandana, 
7382, Yellow, Crescent, Red, Short, Orange, Angry, Blue, , Aviator's Cap, 
7383, Yellow, Professor, Red, Short, Gray, , , 3D Glasses, , 
7384, Pink, Tabby, Brown, Small, Gray, Rainbow, Epic, , Forest Ranger, 
7385, Yellow, Crescent, Blue, Short, Orange, Discerning, Yellow, , Fire, 
7386, Gray, Crescent, Red, Small, Orange, Angry, Gray, , , 
7387, Pink, Robot, Metal, Short, Robot, , , Visor, Skully, Hoodie Down
7388, Yellow, Tabby, White, Small, Orange, Relaxed, Red, , Backwards Hat, 
7389, Pink, Crescent, Pink, Small, Gray, Angry, Gray, , Karate Band, 
7390, Pink, Crescent, Purple, Small, Gray, Angry, White, , Witch's Hat, 
7391, Blue, Crescent, Brown, Short, Orange, Discerning, Gray, , Durag, 
7392, Green, Sage, Purple, Small, Gray, , , Jobs Glasses, , 
7393, Blue, Brave, Pink, Small, Gray, Discerning, Purple, , , 
7394, Gray, Crescent, Gray, Small, Orange, Discerning, Red, , Pirate's Hat, 
7395, Blue, Crescent, Red, Long, Orange, Angry, White, , Lincoln, 
7396, Pink, Crescent, Black, Short, Gray, , , Aviators, Diamond, 
7397, Gray, Crescent, Purple, Short, Gray, , , Aviators, Fire, 
7398, Purple, Stark, Red, Small, Gray, Open, Purple, , Pirate's Hat, 
7399, Purple, Robot, Metal, Long, Robot, Open, Robot, Big Tech, Forest Ranger, Hoodie Down
7400, Pink, Crescent, Purple, Long, Orange, , , Rose-Colored Glasses, Moon Hat, 
7401, Blue, Tabby, Purple, Small, Gray, Open, Blue, , , 
7402, Yellow, Crescent, Black, Long, Gray, Open, Green, , Forest Ranger, 
7403, Yellow, Stark, Gray, Small, Gray, Discerning, Gray, , , 
7404, Purple, Tabby, Blue, Short, Orange, Open, Blue, , , 
7405, Yellow, Tabby, Brown, Short, Orange, Relaxed, Green, , Grail, 
7406, Gray, Crescent, Black, Short, Orange, Angry, Red, , Headphones, 
7407, Blue, Crescent, Red, Small, Gray, Discerning, Blue, , , 
7408, Pink, Professor, Black, Short, Orange, Side-eye, Red, , Bandana, 
7409, Gray, Guardian, Gray, Small, Gray, Open, Blue, , Space Helmet, 
7410, Yellow, Crescent, Black, Small, Orange, Side-eye, White, , Bow, 
7411, Pink, Tabby, White, Short, Gray, Relaxed, Blue, , , Bomber Jacket
7412, Blue, Brave, Brown, Small, Gray, Discerning, White, , , 
7413, Yellow, Crescent, Black, Short, Orange, Relaxed, Purple, , Witch's Hat, 
7414, Green, Brave, Brown, Long, Orange, Adorable, Epic, , Karate Band, 
7415, Blue, Crescent, Black, Short, Orange, Fire, Epic, , Mohawk (Pink), 
7416, Blue, Brave, Black, Short, Orange, Angry, White, , , 
7417, Green, Crescent, Purple, Short, Gray, Relaxed, Green, , Beanie, 
7418, Yellow, Emperor, Gray, Small, Orange, Side-eye, Purple, , , 
7419, Pink, Crescent, Red, Short, Gray, Open, Green, , Witch's Hat, Diamond Necklace
7420, Gray, Crescent, Purple, Short, Gray, Side-eye, Blue, , Dancing Flame, 
7421, Green, Stark, Brown, Small, Orange, Side-eye, Blue, , , 
7422, Green, Crescent, Gray, Small, Orange, Discerning, Gray, , , 
7423, Gray, Tabby, White, Small, Orange, Adorable, Epic, , , 
7424, Pink, Stark, Green, Long, Orange, Adorable, Epic, , , Gold Chain
7425, Yellow, Tranquil, Pink, Long, Gray, , , Black-rimmed Glasses, Dancing Flame, 
7426, Blue, Professor, Red, Short, Gray, Open, Red, , Skully, 
7427, Yellow, Crescent, Purple, Small, Orange, , , Sunglasses, Captain's Cap, 
7428, Pink, Crescent, Brown, Short, Gray, Relaxed, White, Monocle, Fire, 
7429, Gray, Stark, Green, Long, Orange, Open, Green, , , 
7430, Green, Crescent, Blue, Short, Orange, Side-eye, Yellow, , Hero's Cap, Hero's Tunic
7431, Pink, Tabby, Blue, Small, Gray, Open, Purple, , Headband, 
7432, Purple, Crescent, Green, Short, Orange, Angry, Green, , Moon Hat, 
7433, Yellow, Crescent, Brown, Small, Gray, Relaxed, White, , Wizard's Hat, 
7434, Purple, Skeleton, Bone, Long, Skeleton, Relaxed, Skeleton, , Flower, 
7435, Green, Stark, Red, Short, Orange, Open, Purple, Big Tech, , 
7436, Enlightened Purple, Enlightened, Legendary Guardian, , , , , , , 
7437, Green, Crescent, Pink, Small, Orange, Relaxed, Gray, , Moon Hat, 
7438, Pink, Crescent, Blue, Small, Orange, Relaxed, Yellow, , Raincloud, 
7439, Gray, Tabby, Green, Small, Gray, , , Rose-Colored Glasses, Backwards Hat, 
7440, Blue, Tranquil, Black, Short, Orange, Moon, Epic, , Skully, 
7441, Purple, Crescent, Blue, Small, Gray, , , Black-rimmed Glasses, Captain's Cap, 
7442, Yellow, Emperor, White, Small, Orange, Open, White, , Headphones, 
7443, Yellow, Tabby, Brown, Small, Orange, Side-eye, Red, , Skully, 
7444, Blue, Stark, Gray, Long, Orange, Heart, Epic, , , 
7445, Pink, Guardian, Red, Short, Gray, Open, White, , Space Helmet, 
7446, Purple, Crescent, Pink, Short, Gray, Discerning, Gray, , Wizard's Hat, 
7447, Purple, Tranquil, Brown, Short, Orange, Side-eye, Green, , Headphones, 
7448, Yellow, Crescent, Gray, Short, Gray, Adorable, Epic, Monocle, , 
7449, Pink, Sage, Red, Small, Orange, Relaxed, Gray, , , Punk Jacket
7450, Yellow, Tabby, Red, Small, Orange, Relaxed, White, , , 
7451, Yellow, Stark, Green, Short, Gray, Open, Blue, , Cowboy Hat, 
7452, Blue, Crescent, Purple, Long, Gray, Diamond, Epic, , , 
7453, Blue, Tranquil, Black, Short, Gray, Angry, Purple, , Raincloud, 
7454, Pink, Crescent, Red, Short, Gray, Relaxed, White, , Mohawk (Pink), 
7455, Green, Guardian, Blue, Short, Gray, Open, Blue, , , 
7456, Purple, Crescent, Red, Long, Gray, Discerning, White, , Crescent Talisman, 
7457, Yellow, Tranquil, Red, Short, Orange, Open, Gray, , , 
7458, Pink, Crescent, Gray, Small, Gray, Open, Red, , Bucket Hat, 
7459, Yellow, Professor, Red, Small, Gray, Relaxed, White, , , 
7460, Gray, Crescent, Purple, Short, Gray, Relaxed, Green, , Aviator's Cap, 
7461, Pink, Crescent, Black, Short, Gray, Heart, Epic, , , 
7462, Green, Stark, Red, Short, Orange, Adorable, Epic, , Queen's Crown, 
7463, Gray, Tabby, Red, Short, Gray, Discerning, Yellow, , Karate Band, 
7464, Blue, Tranquil, Purple, Short, Gray, Side-eye, Yellow, , Headphones, 
7465, Purple, Crescent, Red, Long, Orange, Adorable, Epic, , Cowboy Hat, 
7466, Green, Crescent, Black, Short, Gray, Relaxed, Green, , , 
7467, Pink, Crescent, Brown, Small, Orange, Discerning, Green, , Beanie, 
7468, Pink, Tranquil, Gray, Small, Orange, Open, White, , Raincloud, Gold Chain
7469, Blue, Brave, Purple, Short, Gray, Diamond, Epic, , Skully, 
7470, Purple, Sage, Purple, Small, Gray, Adorable, Epic, , Mohawk (Green), 
7471, Purple, Guardian, Brown, Small, Orange, Relaxed, Yellow, , Grail, 
7472, Purple, Crescent, White, Short, Gray, , , Aviators, Fire, 
7473, Pink, Tabby, Gray, Small, Gray, Open, Yellow, Half-moon Spectacles, Backwards Hat, Diamond Necklace
7474, Blue, Tranquil, Blue, Small, Orange, Open, Red, , Headband, 
7475, Blue, Professor, Green, Short, Orange, Angry, Yellow, , Headband, 
7476, Pink, Tabby, White, Small, Gray, Side-eye, Yellow, , Fire, 
7477, Yellow, Tranquil, Purple, Short, Gray, Angry, Red, , Queen's Crown, 
7478, Gray, Crescent, Red, Small, Orange, , , Sunglasses, Space Helmet, 
7479, Blue, Brave, Red, Small, Orange, , , 3D Glasses, , Bomber Jacket
7480, Purple, Crescent, White, Long, Gray, , , Sunglasses, Tiara, 
7481, Yellow, Tranquil, Brown, Small, Orange, Side-eye, Purple, , Mohawk (Green), 
7482, Green, Professor, Gray, Short, Orange, Relaxed, Purple, , , 
7483, Green, Emperor, Purple, Small, Gray, Open, Purple, , , Punk Jacket
7484, Gray, Stark, Brown, Short, Gray, , , Sunglasses, Headband, 
7485, Gray, Guardian, Red, Long, Gray, Side-eye, Red, , , 
7486, Pink, Emperor, Red, Small, Orange, Diamond, Epic, , , 
7487, Purple, Tabby, Black, Long, Orange, , , Aviators, Chromie, 
7488, Green, Brave, Red, Short, Gray, Moon, Epic, , , 
7489, Green, Crescent, Pink, Small, Orange, Relaxed, White, , Wizard's Hat, Bomber Jacket
7490, Pink, Stark, Blue, Short, Gray, Open, Green, , Skully, 
7491, Yellow, Tabby, Gray, Small, Orange, , , Aviators, , 
7492, Blue, Tranquil, Red, Small, Gray, Open, Purple, , Headphones, 
7493, Blue, Tranquil, Red, Short, Gray, Angry, White, , Space Helmet, 
7494, Green, Tranquil, Brown, Small, Gray, , , Black-rimmed Glasses, , Hoodie Down
7495, Yellow, Stark, Pink, Small, Orange, Relaxed, Purple, , , 
7496, Green, Crescent, Brown, Long, Gray, Discerning, Purple, , Bow, 
7497, Green, Crescent, Blue, Short, Gray, Open, Red, , Hero's Cap, Hero's Tunic
7498, Pink, Brave, Red, Small, Orange, Angry, Green, , Diamond, 
7499, Pink, Tranquil, Brown, Short, Gray, Relaxed, Blue, , , 
7500, Gray, Guardian, Purple, Small, Orange, Side-eye, Yellow, , , Punk Jacket
7501, Green, Stark, Pink, Short, Orange, Adorable, Epic, , Karate Band, Jean Jacket
7502, Blue, Crescent, Gray, Short, Orange, Open, Red, , Moon Hat, 
7503, Green, Stark, Blue, Small, Gray, Angry, White, Monocle, Moon Hat, 
7504, Green, Tranquil, Brown, Small, Orange, Open, Green, , Mohawk (Green), 
7505, Purple, Crescent, Pink, Short, Gray, Relaxed, Blue, , , 
7506, Purple, Stark, Purple, Long, Orange, , , Jobs Glasses, Space Helmet, 
7507, Green, Tranquil, Black, Small, Gray, Open, Yellow, Half-moon Spectacles, Skully, 
7508, Blue, Tabby, Blue, Small, Orange, Open, Red, , , 
7509, Yellow, Tabby, Purple, Small, Orange, Discerning, Yellow, , Skully, 
7510, Green, Crescent, Pink, Small, Gray, Side-eye, Green, , Moon Hat, 
7511, Gray, Crescent, Black, Small, Orange, Angry, Purple, , Raincloud, 
7512, Gray, Stark, Pink, Small, Orange, Angry, Green, , Mohawk (Green), 
7513, Blue, Professor, Brown, Small, Orange, Relaxed, Yellow, , , 
7514, Purple, Brave, White, Long, Gray, Open, Green, , , 
7515, Green, Brave, Gray, Small, Gray, Angry, White, , , 
7516, Blue, Crescent, Black, Short, Gray, Fire, Epic, , , Hoodie
7517, Blue, Tabby, Purple, Short, Gray, Open, Yellow, , , Hoodie Down
7518, Gray, Crescent, Blue, Short, Orange, Relaxed, White, , , Hoodie
7519, Green, Crescent, Pink, Long, Gray, Side-eye, Purple, , Wizard's Hat, 
7520, Green, Crescent, Brown, Small, Gray, Discerning, Purple, , Bandana, 
7521, Gray, Crescent, Red, Short, Orange, Open, Yellow, , Captain's Cap, 
7522, Green, Crescent, Blue, Long, Orange, Side-eye, Purple, , , Hoodie
7523, Yellow, Guardian, Brown, Short, Orange, Angry, Purple, , , Gold Chain
7524, Pink, Guardian, White, Small, Gray, Adorable, Epic, Half-moon Spectacles, Tiara, 
7525, Blue, Stark, Red, Long, Orange, Open, Red, , Mohawk (Pink), 
7526, Gray, Crescent, Brown, Small, Orange, Open, Purple, , Wizard's Hat, Jean Jacket
7527, Yellow, Crescent, Brown, Long, Gray, Relaxed, Gray, , Hero's Cap, Hero's Tunic
7528, Green, Crescent, White, Short, Gray, , , Jobs Glasses, Karate Band, 
7529, Green, Guardian, Pink, Long, Gray, Angry, Yellow, , , 
7530, Pink, Crescent, Blue, Short, Orange, Discerning, Gray, , Hero's Cap, Hero's Tunic
7531, Yellow, Robot, Metal, Long, Robot, Open, Robot, Big Tech, Space Helmet, 
7532, Yellow, Guardian, Red, Small, Gray, Relaxed, Gray, , , 
7533, Blue, Professor, Brown, Short, Gray, Adorable, Epic, , , 
7534, Green, Crescent, Brown, Small, Orange, Open, Yellow, , Halo, 
7535, Yellow, Crescent, Green, Short, Gray, Side-eye, Gray, , , 
7536, Green, Sage, White, Short, Orange, Relaxed, White, , Mohawk (Green), 
7537, Yellow, Guardian, Purple, Short, Orange, Angry, Red, , , 
7538, Blue, Crescent, Purple, Long, Orange, Open, Purple, , Wizard's Hat, 
7539, Purple, Professor, Red, Small, Gray, Angry, Blue, , Bandana, 
7540, Yellow, Tabby, Gray, Small, Gray, Angry, White, , Queen's Crown, Punk Jacket
7541, Pink, Brave, White, Short, Gray, Adorable, Epic, , , 
7542, Blue, Crescent, Blue, Small, Orange, Open, Purple, , Chromie, 
7543, Purple, Crescent, Red, Short, Gray, Open, Yellow, Monocle, Backwards Hat, 
7544, Blue, Professor, Black, Small, Orange, Rainbow, Epic, , , 
7545, Purple, Stark, Black, Small, Orange, Side-eye, Gray, , Grail, 
7546, Yellow, Emperor, White, Small, Orange, Relaxed, White, Eyepatch, Tiny Crown, 
7547, Green, Crescent, Pink, Small, Orange, Heart, Epic, , , 
7548, Purple, Crescent, Gray, Small, Orange, Adorable, Epic, Half-moon Spectacles, Beanie, 
7549, Yellow, Brave, Black, Small, Orange, , , Black-rimmed Glasses, , Diamond Necklace
7550, Yellow, Crescent, Gray, Small, Orange, Open, White, , , Hoodie
7551, Green, Stark, Blue, Small, Orange, Discerning, Red, , Skully, 
7552, Purple, Ruby Skeleton, Legendary Bone, Small, Ruby, Angry, Skeleton, , Witch's Hat, 
7553, Yellow, Tabby, Red, Long, Gray, Side-eye, Blue, , , Punk Jacket
7554, Gray, Brave, Red, Short, Gray, Side-eye, Gray, , Skully, 
7555, Yellow, Professor, Brown, Small, Orange, Adorable, Epic, , Bandana, 
7556, Blue, Stark, Brown, Small, Gray, Side-eye, Red, , Backwards Hat, 
7557, Green, Tabby, Purple, Long, Gray, , , Jobs Glasses, , Punk Jacket
7558, Green, Crescent, Red, Short, Orange, Open, Gray, , Witch's Hat, 
7559, Blue, Tabby, Purple, Long, Orange, Rainbow, Epic, , Tiara, 
7560, Green, Tranquil, Brown, Short, Gray, Discerning, White, , Headphones, 
7561, Gray, Crescent, Black, Short, Orange, Relaxed, Purple, , Bandana, 
7562, Blue, Tabby, Brown, Small, Gray, Open, White, , Chromie, 
7563, Blue, Crescent, Black, Short, Gray, Open, Yellow, , , 
