2536, Yellow, Stark, Blue, Short, Orange, Rainbow, Epic, , , 
2537, Gray, Crescent, Gray, Small, Orange, Discerning, Green, , , 
2538, Green, Tabby, Gray, Long, Orange, Angry, Yellow, , Fire, 
2539, Yellow, Crescent, Gray, Short, Orange, Open, Green, , Mohawk (Pink), 
2540, Yellow, Stark, Red, Short, Gray, Rainbow, Epic, , Moon Hat, 
2541, Blue, Crescent, Red, Small, Gray, Adorable, Epic, , Skully, 
2542, Green, Guardian, Brown, Long, Orange, Open, Yellow, , , Gold Chain
2543, Yellow, Sage, Black, Small, Orange, Side-eye, Yellow, , , Punk Jacket
2544, Gray, Guardian, Blue, Long, Gray, Heart, Epic, , Grail, 
2545, Purple, Stark, Gray, Short, Orange, , , Black-rimmed Glasses, Backwards Hat, 
2546, Yellow, Stark, Pink, Small, Gray, Rainbow, Epic, , Mohawk (Pink), 
2547, Blue, Tranquil, Brown, Small, Orange, Heart, Epic, , Crescent Talisman, 
2548, Purple, Tabby, Green, Short, Gray, Open, Blue, , Bow, 
2549, Blue, Crescent, Blue, Short, Gray, Relaxed, White, , Wizard's Hat, 
2550, Purple, Tabby, Gray, Short, Orange, Side-eye, Blue, , , 
2551, Gray, Crescent, Red, Short, Gray, Heart, Epic, , Raincloud, 
2552, Blue, Guardian, White, Short, Orange, Heart, Epic, , , 
2553, Pink, Guardian, Gray, Short, Orange, Side-eye, Red, , , 
2554, Gray, Crescent, Pink, Long, Orange, Open, Purple, , Hero's Cap, Hero's Tunic
2555, Green, Stark, Gray, Long, Orange, Discerning, Red, , Headband, 
2556, Yellow, Tabby, Black, Small, Gray, , , 3D Glasses, Backwards Hat, 
2557, Pink, Professor, Red, Long, Gray, Moon, Epic, , , 
2558, Blue, Guardian, Black, Small, Orange, Angry, Yellow, , Cowboy Hat, 
2559, Gray, Crescent, Pink, Short, Gray, Diamond, Epic, , Beanie, 
2560, Pink, Professor, Brown, Small, Gray, Open, Purple, Big Tech, , 
2561, Green, Guardian, Red, Long, Orange, Open, White, , Cowboy Hat, 
2562, Green, Robot, Metal, Long, Robot, Open, Robot, Big Tech, Chromie, Punk Jacket
2563, Purple, Crescent, Black, Small, Gray, Open, Green, , , 
2564, Gray, Tranquil, Red, Small, Gray, Open, Purple, , , 
2565, Purple, Guardian, Blue, Small, Gray, Relaxed, Red, , , Hoodie Down
2566, Gray, Crescent, Red, Small, Orange, , , Jobs Glasses, Tiara, 
2567, Purple, Tranquil, Gray, Small, Gray, Discerning, Green, , Tiara, 
2568, Gray, Tabby, Brown, Small, Gray, Relaxed, Purple, , Tiny Crown, Punk Jacket
2569, Yellow, Brave, Black, Small, Gray, Heart, Epic, , , Diamond Necklace
2570, Pink, Tranquil, Red, Small, Gray, , , Rose-Colored Glasses, , 
2571, Green, Guardian, Red, Short, Gray, Fire, Epic, , , Jean Jacket
2572, Gray, Crescent, Blue, Short, Orange, Side-eye, Purple, , Bucket Hat, 
2573, Gray, Tabby, White, Long, Gray, Side-eye, Yellow, , Raincloud, Hoodie Down
2574, Pink, Crescent, Purple, Short, Gray, Angry, Red, , , Bomber Jacket
2575, Blue, Tranquil, White, Short, Gray, Angry, Purple, , , 
2576, Gray, Stark, Brown, Small, Orange, Open, Purple, , Mohawk (Green), 
2577, Purple, Crescent, Gray, Short, Gray, Discerning, Purple, , , 
2578, Purple, Tabby, Gray, Short, Gray, , , Black-rimmed Glasses, , 
2579, Green, Crescent, Black, Small, Gray, Fire, Epic, , Witch's Hat, 
2580, Pink, Crescent, White, Small, Orange, Relaxed, Purple, , Headband, 
2581, Pink, Stark, White, Long, Orange, Open, Gray, , Mohawk (Green), 
2582, Gray, Guardian, Brown, Short, Gray, Relaxed, Green, , Headphones, 
2583, Pink, Tabby, Green, Short, Gray, Angry, White, , , Punk Jacket
2584, Pink, Guardian, Red, Small, Gray, Rainbow, Epic, , Karate Band, 
2585, Green, Crescent, Purple, Small, Orange, Adorable, Epic, , Captain's Cap, 
2586, Yellow, Crescent, White, Short, Gray, Open, Red, , Durag, Jean Jacket
2587, Blue, Guardian, Purple, Short, Orange, Angry, Green, , , 
2588, Gray, Professor, Gray, Short, Orange, Angry, Red, , Skully, 
2589, Green, Guardian, Gray, Long, Orange, Adorable, Epic, , Space Helmet, 
2590, Green, Crescent, Gray, Small, Gray, Moon, Epic, , , Diamond Necklace
2591, Purple, Crescent, Gray, Short, Orange, Relaxed, Blue, , Moon Hat, 
2592, Green, Tabby, Brown, Small, Gray, Side-eye, Gray, , , Punk Jacket
2593, Blue, Crescent, Red, Small, Gray, Discerning, Red, , Durag, 
2594, Gray, Tabby, Gray, Short, Gray, Discerning, Yellow, , Headphones, 
2595, Purple, Emperor, White, Small, Gray, Angry, Red, , Skully, Gold Chain
2596, Purple, Tabby, Blue, Small, Orange, Open, Purple, , Tiny Crown, 
2597, Green, Crescent, Black, Short, Orange, Open, Blue, , Captain's Cap, 
2598, Yellow, Crescent, Black, Short, Orange, Adorable, Epic, , Hero's Cap, Hero's Tunic
2599, Blue, Stark, White, Short, Gray, Side-eye, White, , Halo, 
2600, Pink, Stark, Brown, Short, Orange, Rainbow, Epic, , Raincloud, 
2601, Pink, Guardian, White, Small, Orange, Relaxed, Blue, , , 
2602, Green, Crescent, Gray, Small, Gray, Relaxed, Gray, , , 
2603, Purple, Crescent, Purple, Short, Gray, Side-eye, Blue, , Captain's Cap, Hoodie Down
2604, Blue, Tabby, Purple, Small, Orange, Relaxed, Blue, , Bandana, 
2605, Green, Tranquil, Purple, Small, Orange, Rainbow, Epic, , Queen's Crown, 
2606, Pink, Crescent, Gray, Short, Gray, Angry, Yellow, , Captain's Cap, 
2607, Blue, Crescent, Black, Small, Orange, Angry, White, , Moon Hat, 
2608, Purple, Professor, Brown, Small, Gray, Relaxed, White, , Flower, 
2609, Yellow, Stark, Purple, Short, Gray, Rainbow, Epic, , Captain's Cap, 
2610, Yellow, Crescent, Black, Short, Gray, Side-eye, Gray, , Mohawk (Green), 
2611, Blue, Crescent, Gray, Small, Gray, Adorable, Epic, , Pirate's Hat, 
2612, Gray, Professor, Red, Long, Orange, Side-eye, Gray, , , 
2613, Blue, Crescent, White, Short, Gray, Relaxed, Green, , Skully, 
2614, Green, Guardian, Gray, Small, Gray, Side-eye, Blue, , , 
2615, Purple, Tranquil, Gray, Short, Orange, Open, Gray, Big Tech, Mohawk (Pink), Bomber Jacket
2616, Blue, Sage, Red, Small, Gray, , , Black-rimmed Glasses, , 
2617, Blue, Sage, Red, Short, Gray, Adorable, Epic, , Flower, 
2618, Pink, Brave, Red, Short, Orange, Open, White, , , 
2619, Blue, Stark, Red, Small, Gray, Rainbow, Epic, , Backwards Hat, 
2620, Green, Emperor, Purple, Short, Orange, Relaxed, Blue, , , 
2621, Gray, Stark, Red, Short, Orange, Open, Red, , Space Helmet, 
2622, Gray, Crescent, Black, Short, Orange, Open, Purple, , Beanie, Hoodie Down
2623, Green, Crescent, Gray, Short, Gray, Discerning, Purple, , Moon Hat, 
2624, Blue, Crescent, Brown, Small, Orange, Open, Green, , Moon Hat, Hoodie Down
2625, Purple, Crescent, Black, Short, Orange, Rainbow, Epic, , , 
2626, Purple, Sage, Red, Small, Gray, Side-eye, Yellow, , , 
2627, Gray, Crescent, Black, Short, Gray, Heart, Epic, , Tiara, 
2628, Purple, Stark, Pink, Short, Orange, Discerning, Purple, , Headband, 
2629, Green, Stark, Pink, Short, Gray, Open, Purple, Eyepatch, , 
2630, Pink, Stark, Gray, Long, Orange, Relaxed, Yellow, , Skully, Hoodie Down
2631, Yellow, Guardian, Gray, Short, Orange, Side-eye, White, , , 
2632, Yellow, Brave, Red, Small, Orange, , , Black-rimmed Glasses, , 
2633, Pink, Crescent, Red, Small, Gray, Relaxed, Red, , Halo, Jean Jacket
2634, Yellow, Professor, Pink, Long, Gray, Open, Red, , , Punk Jacket
2635, Green, Crescent, Blue, Small, Orange, Open, White, , Fire, 
2636, Gray, Crescent, Brown, Small, Gray, Fire, Epic, Half-moon Spectacles, Moon Hat, 
2637, Green, Stark, Brown, Short, Gray, Side-eye, Yellow, , Tiny Crown, 
2638, Blue, Tabby, Purple, Short, Orange, Open, Purple, , Fire, Jean Jacket
2639, Gray, Stark, White, Long, Orange, Open, Blue, , Aviator's Cap, 
2640, Pink, Crescent, Pink, Short, Gray, Open, Yellow, , Durag, 
2641, Purple, Crescent, Blue, Small, Orange, Discerning, Blue, , Forest Ranger, 
2642, Yellow, Crescent, Purple, Short, Gray, Open, Gray, , Backwards Hat, 
2643, Gray, Crescent, Brown, Small, Gray, Discerning, Purple, , Moon Hat, 
2644, Purple, Crescent, Brown, Short, Orange, Fire, Epic, , Crescent Talisman, 
2645, Yellow, Tranquil, Brown, Short, Gray, Fire, Epic, , Space Helmet, 
2646, Yellow, Stark, Gray, Small, Gray, Open, Red, , Mohawk (Pink), 
2647, Yellow, Tabby, Green, Small, Orange, , , Gazelles, Flower, 
2648, Gray, Crescent, Brown, Short, Gray, Discerning, Yellow, , Moon Hat, 
2649, Pink, Guardian, Red, Small, Orange, Discerning, White, , Grail, Diamond Necklace
2650, Pink, Crescent, Blue, Long, Gray, Relaxed, Purple, , Grail, 
2651, Pink, Tabby, Red, Small, Orange, Relaxed, Blue, , Skully, 
2652, Yellow, Professor, Purple, Small, Orange, Relaxed, Gray, , , 
2653, Gray, Tranquil, Brown, Long, Orange, Discerning, Gray, , Skully, 
2654, Gray, Guardian, Gray, Short, Orange, , , Black-rimmed Glasses, , 
2655, Purple, Crescent, Black, Short, Orange, Discerning, Red, , Aviator's Cap, 
2656, Gray, Tabby, Red, Short, Gray, , , 3D Glasses, , 
2657, Gray, Tabby, Purple, Small, Gray, Discerning, Blue, , , 
2658, Gray, Tranquil, White, Short, Gray, Discerning, Yellow, , , 
2659, Purple, Crescent, Brown, Short, Orange, Adorable, Epic, , Witch's Hat, 
2660, Green, Tabby, Purple, Short, Gray, Discerning, Gray, , Grail, 
2661, Purple, Crescent, Green, Long, Orange, , , 3D Glasses, Mohawk (Green), 
2662, Blue, Guardian, Brown, Small, Gray, Discerning, Blue, , Headband, 
2663, Yellow, Tabby, Gray, Short, Gray, Angry, Gray, , Halo, 
2664, Yellow, Stark, Red, Small, Orange, Discerning, Gray, , Backwards Hat, 
2665, Blue, Stark, Red, Small, Orange, Discerning, Gray, , Aviator's Cap, Gold Chain
2666, Gray, Crescent, Gray, Short, Orange, Discerning, Blue, , Beanie, 
2667, Yellow, Crescent, Gray, Small, Orange, Open, Yellow, , Hero's Cap, Hero's Tunic
2668, Pink, Crescent, Brown, Small, Orange, , , Gazelles, Space Helmet, 
2669, Purple, Sage, White, Short, Orange, Discerning, Blue, , Captain's Cap, 
2670, Pink, Crescent, White, Short, Gray, Discerning, Green, , Witch's Hat, 
2671, Green, Tabby, Purple, Small, Orange, Side-eye, White, , , 
2672, Green, Crescent, Brown, Small, Gray, Open, Purple, , Mohawk (Pink), 
2673, Blue, Brave, Black, Small, Orange, Relaxed, Purple, , Raincloud, 
2674, Purple, Crescent, Black, Small, Orange, Relaxed, White, , Aviator's Cap, 
2675, Green, Emperor, Pink, Short, Orange, Open, Yellow, , Headphones, 
2676, Purple, Tranquil, Red, Small, Orange, Angry, Red, , , Gold Chain
2677, Pink, Tabby, Black, Long, Gray, Angry, Gray, , Chromie, 
2678, Gray, Stark, Brown, Small, Gray, Discerning, Blue, , Lincoln, Hoodie Down
2679, Gray, Crescent, Gray, Long, Gray, Discerning, Blue, , Witch's Hat, 
2680, Pink, Crescent, Purple, Long, Gray, Open, Purple, , Fire, 
2681, Green, Stark, Gray, Short, Gray, Relaxed, Red, , Bow, 
2682, Purple, Crescent, Red, Short, Gray, Open, Purple, , , Punk Jacket
2683, Purple, Crescent, Black, Long, Orange, Angry, Red, , Halo, 
2684, Yellow, Tranquil, Red, Short, Gray, , , 3D Glasses, , 
2685, Purple, Tabby, Gray, Short, Orange, Open, Yellow, , Backwards Hat, 
2686, Green, Tabby, Blue, Short, Gray, Angry, Gray, , , 
2687, Gray, Sage, Blue, Small, Gray, , , Visor, Raincloud, Gold Chain
2688, Gray, Stark, Gray, Short, Orange, Relaxed, Green, , Headband, 
2689, Blue, Crescent, Green, Small, Gray, Discerning, White, , , Hoodie
2690, Gray, Professor, Purple, Small, Orange, Open, Yellow, , , 
2691, Green, Crescent, Blue, Short, Orange, Discerning, White, , Hero's Cap, Hero's Tunic
2692, Yellow, Stark, Blue, Small, Orange, , , 3D Glasses, , 
2693, Blue, Crescent, Black, Short, Orange, Relaxed, Purple, , Grail, 
2694, Blue, Crescent, Pink, Small, Orange, Discerning, Yellow, , Wizard's Hat, 
2695, Gray, Crescent, Brown, Short, Orange, Heart, Epic, , Space Helmet, 
2696, Blue, Crescent, White, Long, Orange, Open, White, , Durag, 
2697, Gray, Tabby, Red, Short, Orange, Angry, Purple, Monocle, , 
2698, Green, Crescent, White, Short, Gray, Open, Green, , Grail, Hoodie Down
2699, Blue, Tranquil, White, Short, Gray, Discerning, Purple, , , 
2700, Yellow, Tabby, Black, Short, Gray, , , Jobs Glasses, Space Helmet, 
2701, Pink, Stark, Red, Short, Orange, Moon, Epic, , Mohawk (Pink), 
2702, Blue, Stark, Purple, Short, Orange, , , Gazelles, Fire, 
2703, Green, Tabby, Blue, Small, Gray, Open, Blue, , , Hoodie Down
2704, Pink, Stark, Purple, Short, Orange, Relaxed, Blue, , Cowboy Hat, 
2705, Purple, Crescent, Gray, Small, Orange, Open, Purple, , Tiara, 
2706, Blue, Stark, Purple, Long, Orange, Angry, White, , Lincoln, 
2707, Purple, Crescent, Green, Small, Orange, Adorable, Epic, , Mohawk (Green), 
2708, Pink, Crescent, Gray, Short, Gray, , , Rose-Colored Glasses, Cowboy Hat, 
2709, Green, Stark, Blue, Small, Gray, Adorable, Epic, Half-moon Spectacles, Tiny Crown, 
2710, Blue, Guardian, Green, Short, Gray, Side-eye, Gray, , , 
2711, Blue, Guardian, White, Small, Gray, Discerning, Yellow, , Cowboy Hat, 
2712, Yellow, Emperor, Red, Long, Gray, Open, Gray, , Tiny Crown, 
2713, Purple, Stark, Red, Long, Gray, Angry, Blue, , Fire, 
2714, Blue, Professor, Black, Small, Orange, Relaxed, Gray, , , 
2715, Pink, Brave, Black, Short, Gray, Open, Gray, , Skully, 
2716, Green, Crescent, Brown, Short, Orange, Open, Gray, , Beanie, Jean Jacket
2717, Green, Stark, Brown, Short, Orange, Rainbow, Epic, Eyepatch, , 
2718, Gray, Tabby, Red, Long, Gray, Angry, Red, , Space Helmet, 
2719, Yellow, Professor, Black, Short, Gray, Angry, Gray, , , 
2720, Purple, Stark, Red, Small, Gray, Open, Blue, , Dancing Flame, 
2721, Gray, Tranquil, Purple, Long, Orange, Relaxed, White, , Raincloud, 
2722, Gray, Stark, Brown, Small, Orange, Open, Blue, , Aviator's Cap, 
2723, Blue, Golden, Legendary Emperor, Small, Golden, Open, Golden, , Grail, 
2724, Gray, Stark, Black, Small, Gray, , , Jobs Glasses, Skully, 
2725, Purple, Stark, Pink, Small, Gray, Side-eye, Red, , Cowboy Hat, 
2726, Blue, Professor, Red, Short, Gray, Open, Green, , Bandana, Jean Jacket
2727, Gray, Professor, Blue, Short, Gray, Open, Green, , Skully, 
2728, Pink, Stark, White, Short, Orange, Discerning, Gray, , Grail, 
2729, Gray, Guardian, Brown, Short, Orange, Discerning, White, , Queen's Crown, 
2730, Green, Tabby, Blue, Long, Gray, , , Rose-Colored Glasses, , 
2731, Purple, Brave, Blue, Small, Gray, Open, Blue, Big Tech, , 
2732, Purple, Tranquil, Red, Short, Orange, Open, Blue, , Dancing Flame, 
2733, Green, Crescent, Purple, Short, Orange, Diamond, Epic, , Cowboy Hat, 
2734, Yellow, Tranquil, Brown, Small, Orange, Open, White, , Space Helmet, 
2735, Pink, Professor, Red, Short, Orange, Open, Green, , Skully, 
2736, Yellow, Tabby, Red, Short, Gray, Discerning, Purple, , Karate Band, 
2737, Purple, Tabby, Black, Long, Gray, Angry, White, , Headband, 
2738, Pink, Crescent, Blue, Small, Orange, Heart, Epic, , , 
2739, Green, Crescent, Brown, Short, Orange, Heart, Epic, , Cowboy Hat, 
2740, Green, Crescent, Blue, Short, Gray, Side-eye, Purple, , Queen's Crown, 
2741, Yellow, Stark, Black, Long, Orange, Relaxed, Purple, , Halo, 
2742, Yellow, Stark, Blue, Small, Orange, , , Jobs Glasses, Moon Hat, 
2743, Blue, Tabby, Gray, Small, Orange, Open, Red, , Karate Band, 
2744, Green, Tranquil, Brown, Small, Gray, , , Aviators, Skully, 
2745, Yellow, Tabby, Gray, Short, Orange, Relaxed, Red, , , 
2746, Yellow, Brave, Brown, Small, Gray, , , Gazelles, , 
2747, Blue, Robot, Metal, Long, Robot, Open, Robot, Big Tech, Fire, Punk Jacket
2748, Gray, Crescent, Black, Short, Gray, , , Gazelles, Witch's Hat, 
2749, Purple, Brave, Pink, Short, Orange, , , Black-rimmed Glasses, , 
2750, Purple, Tranquil, Brown, Short, Orange, Fire, Epic, , Skully, Hoodie Down
2751, Blue, Tranquil, Purple, Long, Gray, Discerning, Gray, , Queen's Crown, 
2752, Blue, Tabby, Gray, Short, Orange, Discerning, Green, , Pirate's Hat, 
2753, Gray, Crescent, Purple, Small, Gray, Discerning, White, , Raincloud, 
2754, Gray, Crescent, White, Small, Orange, , , Black-rimmed Glasses, Beanie, 
2755, Purple, Brave, Brown, Short, Orange, Discerning, Blue, , , 
2756, Yellow, Tabby, White, Short, Orange, Side-eye, White, , Raincloud, 
2757, Green, Guardian, Red, Short, Orange, Angry, White, , Headphones, 
2758, Purple, Brave, Brown, Small, Orange, Angry, Blue, , , Bomber Jacket
2759, Gray, Crescent, Red, Short, Orange, Relaxed, Green, , Grail, 
2760, Green, Stark, Red, Small, Orange, Discerning, Blue, , , 
2761, Purple, Stark, Black, Small, Gray, Open, Gray, , , 
2762, Blue, Crescent, Red, Small, Orange, Angry, Purple, , Aviator's Cap, 
2763, Yellow, Sage, Blue, Short, Gray, Relaxed, Blue, , Headband, 
2764, Purple, Guardian, Black, Small, Gray, Discerning, Purple, , , 
2765, Blue, Stark, Pink, Small, Orange, Side-eye, Red, , Space Helmet, 
2766, Pink, Crescent, Blue, Short, Gray, Angry, Purple, , Mohawk (Green), 
2767, Yellow, Emperor, Purple, Small, Orange, , , Visor, , 
2768, Purple, Crescent, Gray, Short, Orange, Side-eye, Green, , Karate Band, Bomber Jacket
2769, Green, Tabby, Purple, Short, Gray, Rainbow, Epic, , Bandana, 
2770, Pink, Crescent, Pink, Short, Orange, Discerning, White, , Forest Ranger, 
2771, Yellow, Crescent, Brown, Short, Orange, Discerning, White, , Halo, 
2772, Purple, Crescent, Black, Short, Orange, Open, Yellow, , Moon Hat, 
2773, Pink, Crescent, Gray, Long, Gray, Open, Yellow, , Pirate's Hat, 
2774, Yellow, Stark, Green, Small, Orange, Open, Blue, , , 
2775, Pink, Sage, Black, Short, Gray, , , Jobs Glasses, Mohawk (Green), 
2776, Green, Crescent, Red, Short, Orange, Side-eye, Blue, , Captain's Cap, 
2777, Gray, Crescent, Blue, Small, Gray, Open, Red, , Wizard's Hat, 
2778, Purple, Brave, Red, Small, Gray, Open, Red, , , 
2779, Gray, Tabby, Red, Small, Orange, Relaxed, Gray, , Fire, 
2780, Green, Crescent, Red, Short, Gray, Open, Yellow, , Beanie, 
2781, Blue, Crescent, Blue, Small, Gray, Open, Yellow, , Wizard's Hat, 
2782, Blue, Crescent, Red, Small, Gray, Relaxed, Green, , Headband, 
2783, Purple, Tranquil, White, Small, Orange, Side-eye, White, , , 
2784, Gray, Brave, Red, Small, Orange, Adorable, Epic, , Bandana, 
2785, Blue, Emperor, Black, Short, Orange, Relaxed, Red, , Headband, 
2786, Blue, Tabby, White, Small, Orange, Open, Purple, , Headphones, 
2787, Blue, Crescent, Purple, Small, Orange, Side-eye, Red, , , Hoodie
2788, Yellow, Stark, Blue, Short, Orange, Discerning, Purple, , Mohawk (Green), 
2789, Green, Crescent, White, Short, Orange, Side-eye, Blue, , , Hoodie
2790, Gray, Tranquil, White, Short, Orange, , , Black-rimmed Glasses, Tiny Crown, 
2791, Gray, Stark, Gray, Short, Orange, Open, Yellow, , Queen's Crown, 
2792, Blue, Stark, Brown, Short, Gray, , , Black-rimmed Glasses, Moon Hat, 
2793, Green, Tabby, Gray, Short, Orange, Relaxed, Blue, , Skully, Gold Chain
2794, Yellow, Stark, White, Small, Orange, Open, Green, , Fire, 
2795, Green, Professor, Green, Small, Gray, Open, Green, Big Tech, Headband, 
2796, Gray, Guardian, Red, Long, Gray, Angry, Green, , Headband, 
2797, Gray, Guardian, Brown, Small, Orange, Open, Red, Half-moon Spectacles, , 
2798, Green, Crescent, Brown, Small, Gray, Side-eye, White, , Moon Hat, 
2799, Blue, Tabby, Gray, Short, Orange, , , Rose-Colored Glasses, Bow, 
2800, Gray, Guardian, White, Long, Gray, Side-eye, Red, , , Hoodie Down
2801, Gray, Crescent, Purple, Small, Orange, Side-eye, Gray, , Beanie, 
2802, Blue, Stark, Brown, Short, Gray, Side-eye, Green, , Grail, 
2803, Purple, Tranquil, Brown, Short, Gray, Open, Yellow, , Tiny Crown, Hoodie Down
2804, Blue, Stark, Blue, Short, Gray, Discerning, Green, , Queen's Crown, 
2805, Gray, Tranquil, Pink, Short, Orange, Open, Red, , , Jean Jacket
2806, Purple, Stark, Red, Small, Gray, Open, Red, , Moon Hat, 
2807, Green, Stark, Black, Short, Orange, Open, Blue, , Skully, 
2808, Blue, Professor, Red, Small, Gray, Relaxed, White, , Bandana, 
2809, Green, Crescent, Red, Small, Gray, Angry, Red, , Mohawk (Pink), 
2810, Purple, Crescent, Red, Small, Orange, Relaxed, Green, , Skully, 
2811, Yellow, Tabby, Blue, Small, Orange, Open, Green, , , 
2812, Gray, Tranquil, Green, Long, Gray, Open, Gray, , , 
2813, Yellow, Guardian, Brown, Small, Orange, Adorable, Epic, , Grail, 
2814, Purple, Tabby, White, Long, Orange, , , Gazelles, Gremplin, 
2815, Gray, Crescent, Blue, Long, Gray, Open, Red, , Backwards Hat, 
2816, Purple, Crescent, Purple, Long, Orange, Discerning, Blue, , Bucket Hat, 
2817, Pink, Crescent, White, Small, Orange, Open, Purple, , Durag, 
2818, Gray, Stark, Brown, Small, Gray, Discerning, Gray, Monocle, Mohawk (Green), 
2819, Green, Crescent, Black, Short, Gray, Side-eye, Purple, , , 
2820, Blue, Tabby, Green, Small, Gray, Angry, Purple, , Fire, 
2821, Gray, Crescent, Red, Long, Orange, Discerning, Green, , Witch's Hat, Hoodie Down
2822, Gray, Tabby, White, Small, Orange, Angry, White, Monocle, Pirate's Hat, 
2823, Pink, Tabby, Purple, Small, Gray, Moon, Epic, , Grail, 
2824, Blue, Crescent, Purple, Small, Gray, Side-eye, Blue, , Cowboy Hat, 
2825, Blue, Tabby, Blue, Long, Gray, Fire, Epic, , , 
2826, Green, Crescent, Pink, Small, Gray, Side-eye, White, , Aviator's Cap, 
2827, Yellow, Crescent, Brown, Small, Gray, Open, Blue, , Hero's Cap, Hero's Tunic
2828, Gray, Crescent, Brown, Small, Orange, Relaxed, Gray, , Mohawk (Green), 
2829, Pink, Crescent, Pink, Small, Orange, Relaxed, Blue, Eyepatch, Lincoln, 
2830, Pink, Tranquil, Blue, Small, Orange, Fire, Epic, , Tiara, 
2831, Purple, Emperor, Brown, Long, Gray, , , Aviators, , 
2832, Pink, Professor, Black, Short, Orange, Side-eye, White, , , 
2833, Pink, Tabby, Brown, Small, Orange, Discerning, Red, , Backwards Hat, 
2834, Gray, Crescent, Purple, Small, Gray, Adorable, Epic, , Raincloud, 
2835, Gray, Crescent, Red, Long, Orange, Angry, Red, , Beanie, 
2836, Purple, Crescent, Brown, Short, Orange, Relaxed, Purple, , , Hoodie
2837, Gray, Crescent, Gray, Small, Gray, Discerning, Red, , Fire, 
2838, Yellow, Crescent, Purple, Small, Gray, Relaxed, White, , Hero's Cap, Hero's Tunic
2839, Purple, Emperor, Gray, Long, Orange, Discerning, Blue, , , 
2840, Pink, Crescent, Gray, Short, Gray, Side-eye, Blue, , Witch's Hat, 
2841, Gray, Tabby, Pink, Long, Gray, Open, Green, , Fire, 
2842, Purple, Sage, Brown, Small, Gray, Side-eye, Red, , Captain's Cap, 
2843, Yellow, Brave, Blue, Small, Orange, Angry, Blue, , , 
2844, Blue, Stark, Brown, Small, Orange, Open, Red, , Pirate's Hat, Jean Jacket
2845, Blue, Tabby, Black, Short, Gray, Adorable, Epic, , Backwards Hat, 
2846, Blue, Crescent, Pink, Small, Gray, Open, Purple, , , Hoodie
2847, Green, Tabby, Black, Short, Gray, Open, White, , , 
2848, Gray, Crescent, Gray, Small, Gray, Open, Green, , Karate Band, 
2849, Pink, Stark, Brown, Short, Orange, Discerning, Red, , Headband, 
2850, Green, Crescent, White, Small, Orange, Angry, Yellow, , , 
2851, Gray, Professor, Gray, Short, Gray, Adorable, Epic, , Karate Band, 
2852, Blue, Tranquil, White, Short, Orange, Diamond, Epic, , Space Helmet, 
2853, Gray, Stark, Pink, Small, Orange, Angry, Red, , Skully, Jean Jacket
2854, Gray, Emperor, Red, Small, Gray, Heart, Epic, , , 
2855, Green, Guardian, Blue, Short, Gray, Angry, White, , , 
2856, Blue, Crescent, Gray, Small, Orange, Open, Blue, , Beanie, 
2857, Pink, Crescent, Blue, Long, Orange, Open, Yellow, , Lincoln, 
2858, Yellow, Stark, White, Small, Gray, , , Jobs Glasses, Lincoln, 
2859, Blue, Tabby, White, Small, Gray, Rainbow, Epic, , Pirate's Hat, 
2860, Purple, Robot, Metal, Long, Robot, , , Visor, Backwards Hat, 
2861, Gray, Tabby, Brown, Small, Orange, Relaxed, Green, , Fire, 
2862, Blue, Emperor, Red, Small, Orange, Relaxed, Purple, , Headband, Hoodie Down
2863, Blue, Crescent, Purple, Short, Gray, Open, Yellow, , Hero's Cap, Hero's Tunic
2864, Green, Crescent, Gray, Long, Gray, , , Visor, Mohawk (Pink), 
2865, Purple, Professor, Black, Long, Orange, Angry, Blue, , , 
2866, Blue, Brave, Red, Small, Orange, Discerning, Green, , Rubber Duck, 
2867, Pink, Crescent, Pink, Short, Gray, Side-eye, Red, , Witch's Hat, 
2868, Purple, Tabby, Brown, Long, Gray, Angry, Gray, , Tiny Crown, 
2869, Purple, Stark, Blue, Small, Orange, Angry, Gray, , Queen's Crown, 
2870, Blue, Guardian, Gray, Small, Orange, Open, Purple, , Queen's Crown, 
2871, Gray, Tranquil, Red, Short, Orange, Relaxed, Yellow, , Skully, Hoodie Down
2872, Green, Crescent, Purple, Long, Orange, Open, White, , Moon Hat, 
2873, Green, Brave, Gray, Short, Gray, Discerning, Purple, , , 
2874, Blue, Crescent, Red, Small, Orange, Side-eye, Blue, Eyepatch, , 
2875, Cosmic Purple, Cosmic, Legendary Professor, , , , , , , 
2876, Pink, Crescent, Gray, Small, Gray, Side-eye, Blue, , Durag, 
2877, Purple, Crescent, Red, Small, Orange, Diamond, Epic, , Moon Hat, 
2878, Gray, Tabby, Brown, Short, Gray, Relaxed, Yellow, , Skully, 
2879, Blue, Stark, Brown, Long, Gray, Open, Gray, , Bandana, 
2880, Blue, Crescent, Brown, Small, Orange, Diamond, Epic, , Bucket Hat, 
2881, Yellow, Guardian, Gray, Small, Orange, Moon, Epic, , Headphones, 
2882, Green, Professor, Brown, Short, Orange, Discerning, Purple, Monocle, , 
2883, Yellow, Crescent, Purple, Long, Orange, , , Aviators, Fire, Bomber Jacket
2884, Blue, Tabby, Black, Small, Orange, Discerning, Purple, , Crescent Talisman, 
2885, Green, Professor, Pink, Short, Gray, Discerning, Gray, , , 
2886, Yellow, Tranquil, Black, Small, Gray, , , Rose-Colored Glasses, Raincloud, 
2887, Purple, Crescent, Gray, Short, Orange, Relaxed, Purple, , Hero's Cap, Hero's Tunic
2888, Yellow, Guardian, Brown, Small, Gray, Discerning, Red, , , 
2889, Pink, Crescent, Blue, Small, Orange, Relaxed, Yellow, , Forest Ranger, 
2890, Pink, Stark, Red, Short, Orange, , , Visor, Mohawk (Pink), 
2891, Pink, Stark, Brown, Short, Gray, Open, Purple, Monocle, Grail, 
2892, Gray, Crescent, Blue, Long, Gray, Open, Green, , , 
2893, Green, Crescent, Brown, Short, Orange, Open, Purple, Big Tech, Bandana, 
2894, Green, Crescent, Black, Long, Orange, Angry, Yellow, , Witch's Hat, 
2895, Blue, Emperor, Red, Short, Gray, Angry, Yellow, , Skully, 
